Доп. объявление	Название группы	Фраза (с минус-словами)	Заголовок 1	Заголовок 2	Текст	Ссылка
-	Белово - Ремонт	ремонт кровли белово	Ремонт крыши в Белово	Гарантия до 39 лет!	Устраним протечки. Бесплатный замер за 2 мин. Опыт более 15 лет. Звоните!	belovo.krovstroyrf.ru/uslugi/demontazh-i-remont-krovli?utm_source=yandex&utm_medium=cpc&utm_campaign=belovo_tenant1
-	Белово - Ремонт	ремонт крыши белово	Ремонт крыши в Белово	Гарантия до 39 лет!	Устраним протечки. Бесплатный замер за 2 мин. Опыт более 15 лет. Звоните!	belovo.krovstroyrf.ru/uslugi/demontazh-i-remont-krovli?utm_source=yandex&utm_medium=cpc&utm_campaign=belovo_tenant1
-	Белово - Ремонт	демонтаж крыши белово	Ремонт крыши в Белово	Гарантия до 39 лет!	Устраним протечки. Бесплатный замер за 2 мин. Опыт более 15 лет. Звоните!	belovo.krovstroyrf.ru/uslugi/demontazh-i-remont-krovli?utm_source=yandex&utm_medium=cpc&utm_campaign=belovo_tenant1
-	Белово - Ремонт	устранение протечек крыши белово	Ремонт крыши в Белово	Гарантия до 39 лет!	Устраним протечки. Бесплатный замер за 2 мин. Опыт более 15 лет. Звоните!	belovo.krovstroyrf.ru/uslugi/demontazh-i-remont-krovli?utm_source=yandex&utm_medium=cpc&utm_campaign=belovo_tenant1
-	Белово - Ремонт	ремонт крыши частного дома белово	Ремонт крыши в Белово	Гарантия до 39 лет!	Устраним протечки. Бесплатный замер за 2 мин. Опыт более 15 лет. Звоните!	belovo.krovstroyrf.ru/uslugi/demontazh-i-remont-krovli?utm_source=yandex&utm_medium=cpc&utm_campaign=belovo_tenant1
-	Белово - Монтаж	монтаж кровли белово	Кровля под ключ в Белово	Опытные кровельщики	Надежный монтаж кровли под ключ. Скидка 10% на материалы при заказе! Звони.	belovo.krovstroyrf.ru/?utm_source=yandex&utm_medium=cpc&utm_campaign=belovo_tenant1
-	Белово - Монтаж	кровельные работы белово	Кровля под ключ в Белово	Опытные кровельщики	Надежный монтаж кровли под ключ. Скидка 10% на материалы при заказе! Звони.	belovo.krovstroyrf.ru/?utm_source=yandex&utm_medium=cpc&utm_campaign=belovo_tenant1
-	Белово - Монтаж	крыша под ключ белово	Кровля под ключ в Белово	Опытные кровельщики	Надежный монтаж кровли под ключ. Скидка 10% на материалы при заказе! Звони.	belovo.krovstroyrf.ru/?utm_source=yandex&utm_medium=cpc&utm_campaign=belovo_tenant1
-	Белово - Монтаж	перекрыть крышу белово	Кровля под ключ в Белово	Опытные кровельщики	Надежный монтаж кровли под ключ. Скидка 10% на материалы при заказе! Звони.	belovo.krovstroyrf.ru/?utm_source=yandex&utm_medium=cpc&utm_campaign=belovo_tenant1
-	Белово - Монтаж	строительство крыши белово	Кровля под ключ в Белово	Опытные кровельщики	Надежный монтаж кровли под ключ. Скидка 10% на материалы при заказе! Звони.	belovo.krovstroyrf.ru/?utm_source=yandex&utm_medium=cpc&utm_campaign=belovo_tenant1
-	Белово - Металлочерепица	монтаж металлочерепицы белово	Монтаж металлочерепицы	От 1500 руб/м². Под ключ	Качественная кровля из металлочерепицы. Выезд замерщика бесплатно!	belovo.krovstroyrf.ru/uslugi/montazh-krovli-iz-metallocherepitsy?utm_source=yandex&utm_medium=cpc&utm_campaign=belovo_tenant1
-	Белово - Металлочерепица	крыша из металлочерепицы белово	Монтаж металлочерепицы	От 1500 руб/м². Под ключ	Качественная кровля из металлочерепицы. Выезд замерщика бесплатно!	belovo.krovstroyrf.ru/uslugi/montazh-krovli-iz-metallocherepitsy?utm_source=yandex&utm_medium=cpc&utm_campaign=belovo_tenant1
-	Белово - Металлочерепица	металлочерепица под ключ белово	Монтаж металлочерепицы	От 1500 руб/м². Под ключ	Качественная кровля из металлочерепицы. Выезд замерщика бесплатно!	belovo.krovstroyrf.ru/uslugi/montazh-krovli-iz-metallocherepitsy?utm_source=yandex&utm_medium=cpc&utm_campaign=belovo_tenant1
-	Белово - Металлочерепица	кровля металлочерепица цена белово	Монтаж металлочерепицы	От 1500 руб/м². Под ключ	Качественная кровля из металлочерепицы. Выезд замерщика бесплатно!	belovo.krovstroyrf.ru/uslugi/montazh-krovli-iz-metallocherepitsy?utm_source=yandex&utm_medium=cpc&utm_campaign=belovo_tenant1
-	Белово - Профнастил	монтаж профнастила на крышу белово	Кровля из профнастила	От 1400 руб/м² в Белово	Надежный монтаж крыши из профнастила. Строго по договору без скрытых платежей.	belovo.krovstroyrf.ru/uslugi/montazh-krovli-iz-profnastila?utm_source=yandex&utm_medium=cpc&utm_campaign=belovo_tenant1
-	Белово - Профнастил	крыша из профнастила белово	Кровля из профнастила	От 1400 руб/м² в Белово	Надежный монтаж крыши из профнастила. Строго по договору без скрытых платежей.	belovo.krovstroyrf.ru/uslugi/montazh-krovli-iz-profnastila?utm_source=yandex&utm_medium=cpc&utm_campaign=belovo_tenant1
-	Белово - Профнастил	перекрыть крышу профлистом белово	Кровля из профнастила	От 1400 руб/м² в Белово	Надежный монтаж крыши из профнастила. Строго по договору без скрытых платежей.	belovo.krovstroyrf.ru/uslugi/montazh-krovli-iz-profnastila?utm_source=yandex&utm_medium=cpc&utm_campaign=belovo_tenant1
-	Белово - Профнастил	кровля профнастил цена белово	Кровля из профнастила	От 1400 руб/м² в Белово	Надежный монтаж крыши из профнастила. Строго по договору без скрытых платежей.	belovo.krovstroyrf.ru/uslugi/montazh-krovli-iz-profnastila?utm_source=yandex&utm_medium=cpc&utm_campaign=belovo_tenant1
-	Белово - Гибкая черепица	монтаж мягкой кровли белово	Монтаж гибкой черепицы	Идеальная крыша для дома	Профессиональная укладка гибкой (мягкой) черепицы от 1800 руб/м². Гарантия!	belovo.krovstroyrf.ru/uslugi/montazh-krovli-iz-gibkoj-cherepitsy?utm_source=yandex&utm_medium=cpc&utm_campaign=belovo_tenant1
-	Белово - Гибкая черепица	гибкая черепица монтаж белово	Монтаж гибкой черепицы	Идеальная крыша для дома	Профессиональная укладка гибкой (мягкой) черепицы от 1800 руб/м². Гарантия!	belovo.krovstroyrf.ru/uslugi/montazh-krovli-iz-gibkoj-cherepitsy?utm_source=yandex&utm_medium=cpc&utm_campaign=belovo_tenant1
-	Белово - Гибкая черепица	мягкая кровля цена белово	Монтаж гибкой черепицы	Идеальная крыша для дома	Профессиональная укладка гибкой (мягкой) черепицы от 1800 руб/м². Гарантия!	belovo.krovstroyrf.ru/uslugi/montazh-krovli-iz-gibkoj-cherepitsy?utm_source=yandex&utm_medium=cpc&utm_campaign=belovo_tenant1
-	Белово - Гибкая черепица	укладка мягкой черепицы белово	Монтаж гибкой черепицы	Идеальная крыша для дома	Профессиональная укладка гибкой (мягкой) черепицы от 1800 руб/м². Гарантия!	belovo.krovstroyrf.ru/uslugi/montazh-krovli-iz-gibkoj-cherepitsy?utm_source=yandex&utm_medium=cpc&utm_campaign=belovo_tenant1
