Доп. объявление	Название группы	Фраза (с минус-словами)	Заголовок 1	Заголовок 2	Текст	Ссылка
-	Бузулук - Ремонт	ремонт кровли бузулук	Ремонт крыши в Бузулук	Гарантия до 39 лет!	Устраним протечки. Бесплатный замер за 2 мин. Опыт более 15 лет. Звоните!	buzuluk.krovstroyrf.ru/uslugi/demontazh-i-remont-krovli?utm_source=yandex&utm_medium=cpc&utm_campaign=buzuluk_tenant1
-	Бузулук - Ремонт	ремонт крыши бузулук	Ремонт крыши в Бузулук	Гарантия до 39 лет!	Устраним протечки. Бесплатный замер за 2 мин. Опыт более 15 лет. Звоните!	buzuluk.krovstroyrf.ru/uslugi/demontazh-i-remont-krovli?utm_source=yandex&utm_medium=cpc&utm_campaign=buzuluk_tenant1
-	Бузулук - Ремонт	демонтаж крыши бузулук	Ремонт крыши в Бузулук	Гарантия до 39 лет!	Устраним протечки. Бесплатный замер за 2 мин. Опыт более 15 лет. Звоните!	buzuluk.krovstroyrf.ru/uslugi/demontazh-i-remont-krovli?utm_source=yandex&utm_medium=cpc&utm_campaign=buzuluk_tenant1
-	Бузулук - Ремонт	устранение протечек крыши бузулук	Ремонт крыши в Бузулук	Гарантия до 39 лет!	Устраним протечки. Бесплатный замер за 2 мин. Опыт более 15 лет. Звоните!	buzuluk.krovstroyrf.ru/uslugi/demontazh-i-remont-krovli?utm_source=yandex&utm_medium=cpc&utm_campaign=buzuluk_tenant1
-	Бузулук - Ремонт	ремонт крыши частного дома бузулук	Ремонт крыши в Бузулук	Гарантия до 39 лет!	Устраним протечки. Бесплатный замер за 2 мин. Опыт более 15 лет. Звоните!	buzuluk.krovstroyrf.ru/uslugi/demontazh-i-remont-krovli?utm_source=yandex&utm_medium=cpc&utm_campaign=buzuluk_tenant1
-	Бузулук - Монтаж	монтаж кровли бузулук	Кровля под ключ в Бузулук	Опытные кровельщики	Надежный монтаж кровли под ключ. Скидка 10% на материалы при заказе! Звони.	buzuluk.krovstroyrf.ru/?utm_source=yandex&utm_medium=cpc&utm_campaign=buzuluk_tenant1
-	Бузулук - Монтаж	кровельные работы бузулук	Кровля под ключ в Бузулук	Опытные кровельщики	Надежный монтаж кровли под ключ. Скидка 10% на материалы при заказе! Звони.	buzuluk.krovstroyrf.ru/?utm_source=yandex&utm_medium=cpc&utm_campaign=buzuluk_tenant1
-	Бузулук - Монтаж	крыша под ключ бузулук	Кровля под ключ в Бузулук	Опытные кровельщики	Надежный монтаж кровли под ключ. Скидка 10% на материалы при заказе! Звони.	buzuluk.krovstroyrf.ru/?utm_source=yandex&utm_medium=cpc&utm_campaign=buzuluk_tenant1
-	Бузулук - Монтаж	перекрыть крышу бузулук	Кровля под ключ в Бузулук	Опытные кровельщики	Надежный монтаж кровли под ключ. Скидка 10% на материалы при заказе! Звони.	buzuluk.krovstroyrf.ru/?utm_source=yandex&utm_medium=cpc&utm_campaign=buzuluk_tenant1
-	Бузулук - Монтаж	строительство крыши бузулук	Кровля под ключ в Бузулук	Опытные кровельщики	Надежный монтаж кровли под ключ. Скидка 10% на материалы при заказе! Звони.	buzuluk.krovstroyrf.ru/?utm_source=yandex&utm_medium=cpc&utm_campaign=buzuluk_tenant1
-	Бузулук - Металлочерепица	монтаж металлочерепицы бузулук	Монтаж металлочерепицы	От 1500 руб/м². Под ключ	Качественная кровля из металлочерепицы. Выезд замерщика бесплатно!	buzuluk.krovstroyrf.ru/uslugi/montazh-krovli-iz-metallocherepitsy?utm_source=yandex&utm_medium=cpc&utm_campaign=buzuluk_tenant1
-	Бузулук - Металлочерепица	крыша из металлочерепицы бузулук	Монтаж металлочерепицы	От 1500 руб/м². Под ключ	Качественная кровля из металлочерепицы. Выезд замерщика бесплатно!	buzuluk.krovstroyrf.ru/uslugi/montazh-krovli-iz-metallocherepitsy?utm_source=yandex&utm_medium=cpc&utm_campaign=buzuluk_tenant1
-	Бузулук - Металлочерепица	металлочерепица под ключ бузулук	Монтаж металлочерепицы	От 1500 руб/м². Под ключ	Качественная кровля из металлочерепицы. Выезд замерщика бесплатно!	buzuluk.krovstroyrf.ru/uslugi/montazh-krovli-iz-metallocherepitsy?utm_source=yandex&utm_medium=cpc&utm_campaign=buzuluk_tenant1
-	Бузулук - Металлочерепица	кровля металлочерепица цена бузулук	Монтаж металлочерепицы	От 1500 руб/м². Под ключ	Качественная кровля из металлочерепицы. Выезд замерщика бесплатно!	buzuluk.krovstroyrf.ru/uslugi/montazh-krovli-iz-metallocherepitsy?utm_source=yandex&utm_medium=cpc&utm_campaign=buzuluk_tenant1
-	Бузулук - Профнастил	монтаж профнастила на крышу бузулук	Кровля из профнастила	От 1400 руб/м² в Бузулук	Надежный монтаж крыши из профнастила. Строго по договору без скрытых платежей.	buzuluk.krovstroyrf.ru/uslugi/montazh-krovli-iz-profnastila?utm_source=yandex&utm_medium=cpc&utm_campaign=buzuluk_tenant1
-	Бузулук - Профнастил	крыша из профнастила бузулук	Кровля из профнастила	От 1400 руб/м² в Бузулук	Надежный монтаж крыши из профнастила. Строго по договору без скрытых платежей.	buzuluk.krovstroyrf.ru/uslugi/montazh-krovli-iz-profnastila?utm_source=yandex&utm_medium=cpc&utm_campaign=buzuluk_tenant1
-	Бузулук - Профнастил	перекрыть крышу профлистом бузулук	Кровля из профнастила	От 1400 руб/м² в Бузулук	Надежный монтаж крыши из профнастила. Строго по договору без скрытых платежей.	buzuluk.krovstroyrf.ru/uslugi/montazh-krovli-iz-profnastila?utm_source=yandex&utm_medium=cpc&utm_campaign=buzuluk_tenant1
-	Бузулук - Профнастил	кровля профнастил цена бузулук	Кровля из профнастила	От 1400 руб/м² в Бузулук	Надежный монтаж крыши из профнастила. Строго по договору без скрытых платежей.	buzuluk.krovstroyrf.ru/uslugi/montazh-krovli-iz-profnastila?utm_source=yandex&utm_medium=cpc&utm_campaign=buzuluk_tenant1
-	Бузулук - Гибкая черепица	монтаж мягкой кровли бузулук	Монтаж гибкой черепицы	Идеальная крыша для дома	Профессиональная укладка гибкой (мягкой) черепицы от 1800 руб/м². Гарантия!	buzuluk.krovstroyrf.ru/uslugi/montazh-krovli-iz-gibkoj-cherepitsy?utm_source=yandex&utm_medium=cpc&utm_campaign=buzuluk_tenant1
-	Бузулук - Гибкая черепица	гибкая черепица монтаж бузулук	Монтаж гибкой черепицы	Идеальная крыша для дома	Профессиональная укладка гибкой (мягкой) черепицы от 1800 руб/м². Гарантия!	buzuluk.krovstroyrf.ru/uslugi/montazh-krovli-iz-gibkoj-cherepitsy?utm_source=yandex&utm_medium=cpc&utm_campaign=buzuluk_tenant1
-	Бузулук - Гибкая черепица	мягкая кровля цена бузулук	Монтаж гибкой черепицы	Идеальная крыша для дома	Профессиональная укладка гибкой (мягкой) черепицы от 1800 руб/м². Гарантия!	buzuluk.krovstroyrf.ru/uslugi/montazh-krovli-iz-gibkoj-cherepitsy?utm_source=yandex&utm_medium=cpc&utm_campaign=buzuluk_tenant1
-	Бузулук - Гибкая черепица	укладка мягкой черепицы бузулук	Монтаж гибкой черепицы	Идеальная крыша для дома	Профессиональная укладка гибкой (мягкой) черепицы от 1800 руб/м². Гарантия!	buzuluk.krovstroyrf.ru/uslugi/montazh-krovli-iz-gibkoj-cherepitsy?utm_source=yandex&utm_medium=cpc&utm_campaign=buzuluk_tenant1
