Доп. объявление	Название группы	Фраза (с минус-словами)	Заголовок 1	Заголовок 2	Текст	Ссылка
-	Альметьевск - Ремонт	ремонт кровли альметьевск	Ремонт крыши в Альметьевск	Гарантия до 39 лет!	Устраним протечки. Бесплатный замер за 2 мин. Опыт более 15 лет. Звоните!	almetevsk.krovstroyrf.ru/uslugi/demontazh-i-remont-krovli?utm_source=yandex&utm_medium=cpc&utm_campaign=almetevsk_tenant1
-	Альметьевск - Ремонт	ремонт крыши альметьевск	Ремонт крыши в Альметьевск	Гарантия до 39 лет!	Устраним протечки. Бесплатный замер за 2 мин. Опыт более 15 лет. Звоните!	almetevsk.krovstroyrf.ru/uslugi/demontazh-i-remont-krovli?utm_source=yandex&utm_medium=cpc&utm_campaign=almetevsk_tenant1
-	Альметьевск - Ремонт	демонтаж крыши альметьевск	Ремонт крыши в Альметьевск	Гарантия до 39 лет!	Устраним протечки. Бесплатный замер за 2 мин. Опыт более 15 лет. Звоните!	almetevsk.krovstroyrf.ru/uslugi/demontazh-i-remont-krovli?utm_source=yandex&utm_medium=cpc&utm_campaign=almetevsk_tenant1
-	Альметьевск - Ремонт	устранение протечек крыши альметьевск	Ремонт крыши в Альметьевск	Гарантия до 39 лет!	Устраним протечки. Бесплатный замер за 2 мин. Опыт более 15 лет. Звоните!	almetevsk.krovstroyrf.ru/uslugi/demontazh-i-remont-krovli?utm_source=yandex&utm_medium=cpc&utm_campaign=almetevsk_tenant1
-	Альметьевск - Ремонт	ремонт крыши частного дома альметьевск	Ремонт крыши в Альметьевск	Гарантия до 39 лет!	Устраним протечки. Бесплатный замер за 2 мин. Опыт более 15 лет. Звоните!	almetevsk.krovstroyrf.ru/uslugi/demontazh-i-remont-krovli?utm_source=yandex&utm_medium=cpc&utm_campaign=almetevsk_tenant1
-	Альметьевск - Монтаж	монтаж кровли альметьевск	Кровля под ключ в Альметьевск	Опытные кровельщики	Надежный монтаж кровли под ключ. Скидка 10% на материалы при заказе! Звони.	almetevsk.krovstroyrf.ru/?utm_source=yandex&utm_medium=cpc&utm_campaign=almetevsk_tenant1
-	Альметьевск - Монтаж	кровельные работы альметьевск	Кровля под ключ в Альметьевск	Опытные кровельщики	Надежный монтаж кровли под ключ. Скидка 10% на материалы при заказе! Звони.	almetevsk.krovstroyrf.ru/?utm_source=yandex&utm_medium=cpc&utm_campaign=almetevsk_tenant1
-	Альметьевск - Монтаж	крыша под ключ альметьевск	Кровля под ключ в Альметьевск	Опытные кровельщики	Надежный монтаж кровли под ключ. Скидка 10% на материалы при заказе! Звони.	almetevsk.krovstroyrf.ru/?utm_source=yandex&utm_medium=cpc&utm_campaign=almetevsk_tenant1
-	Альметьевск - Монтаж	перекрыть крышу альметьевск	Кровля под ключ в Альметьевск	Опытные кровельщики	Надежный монтаж кровли под ключ. Скидка 10% на материалы при заказе! Звони.	almetevsk.krovstroyrf.ru/?utm_source=yandex&utm_medium=cpc&utm_campaign=almetevsk_tenant1
-	Альметьевск - Монтаж	строительство крыши альметьевск	Кровля под ключ в Альметьевск	Опытные кровельщики	Надежный монтаж кровли под ключ. Скидка 10% на материалы при заказе! Звони.	almetevsk.krovstroyrf.ru/?utm_source=yandex&utm_medium=cpc&utm_campaign=almetevsk_tenant1
-	Альметьевск - Металлочерепица	монтаж металлочерепицы альметьевск	Монтаж металлочерепицы	От 1500 руб/м². Под ключ	Качественная кровля из металлочерепицы. Выезд замерщика бесплатно!	almetevsk.krovstroyrf.ru/uslugi/montazh-krovli-iz-metallocherepitsy?utm_source=yandex&utm_medium=cpc&utm_campaign=almetevsk_tenant1
-	Альметьевск - Металлочерепица	крыша из металлочерепицы альметьевск	Монтаж металлочерепицы	От 1500 руб/м². Под ключ	Качественная кровля из металлочерепицы. Выезд замерщика бесплатно!	almetevsk.krovstroyrf.ru/uslugi/montazh-krovli-iz-metallocherepitsy?utm_source=yandex&utm_medium=cpc&utm_campaign=almetevsk_tenant1
-	Альметьевск - Металлочерепица	металлочерепица под ключ альметьевск	Монтаж металлочерепицы	От 1500 руб/м². Под ключ	Качественная кровля из металлочерепицы. Выезд замерщика бесплатно!	almetevsk.krovstroyrf.ru/uslugi/montazh-krovli-iz-metallocherepitsy?utm_source=yandex&utm_medium=cpc&utm_campaign=almetevsk_tenant1
-	Альметьевск - Металлочерепица	кровля металлочерепица цена альметьевск	Монтаж металлочерепицы	От 1500 руб/м². Под ключ	Качественная кровля из металлочерепицы. Выезд замерщика бесплатно!	almetevsk.krovstroyrf.ru/uslugi/montazh-krovli-iz-metallocherepitsy?utm_source=yandex&utm_medium=cpc&utm_campaign=almetevsk_tenant1
-	Альметьевск - Профнастил	монтаж профнастила на крышу альметьевск	Кровля из профнастила	От 1400 руб/м² в Альметьевск	Надежный монтаж крыши из профнастила. Строго по договору без скрытых платежей.	almetevsk.krovstroyrf.ru/uslugi/montazh-krovli-iz-profnastila?utm_source=yandex&utm_medium=cpc&utm_campaign=almetevsk_tenant1
-	Альметьевск - Профнастил	крыша из профнастила альметьевск	Кровля из профнастила	От 1400 руб/м² в Альметьевск	Надежный монтаж крыши из профнастила. Строго по договору без скрытых платежей.	almetevsk.krovstroyrf.ru/uslugi/montazh-krovli-iz-profnastila?utm_source=yandex&utm_medium=cpc&utm_campaign=almetevsk_tenant1
-	Альметьевск - Профнастил	перекрыть крышу профлистом альметьевск	Кровля из профнастила	От 1400 руб/м² в Альметьевск	Надежный монтаж крыши из профнастила. Строго по договору без скрытых платежей.	almetevsk.krovstroyrf.ru/uslugi/montazh-krovli-iz-profnastila?utm_source=yandex&utm_medium=cpc&utm_campaign=almetevsk_tenant1
-	Альметьевск - Профнастил	кровля профнастил цена альметьевск	Кровля из профнастила	От 1400 руб/м² в Альметьевск	Надежный монтаж крыши из профнастила. Строго по договору без скрытых платежей.	almetevsk.krovstroyrf.ru/uslugi/montazh-krovli-iz-profnastila?utm_source=yandex&utm_medium=cpc&utm_campaign=almetevsk_tenant1
-	Альметьевск - Гибкая черепица	монтаж мягкой кровли альметьевск	Монтаж гибкой черепицы	Идеальная крыша для дома	Профессиональная укладка гибкой (мягкой) черепицы от 1800 руб/м². Гарантия!	almetevsk.krovstroyrf.ru/uslugi/montazh-krovli-iz-gibkoj-cherepitsy?utm_source=yandex&utm_medium=cpc&utm_campaign=almetevsk_tenant1
-	Альметьевск - Гибкая черепица	гибкая черепица монтаж альметьевск	Монтаж гибкой черепицы	Идеальная крыша для дома	Профессиональная укладка гибкой (мягкой) черепицы от 1800 руб/м². Гарантия!	almetevsk.krovstroyrf.ru/uslugi/montazh-krovli-iz-gibkoj-cherepitsy?utm_source=yandex&utm_medium=cpc&utm_campaign=almetevsk_tenant1
-	Альметьевск - Гибкая черепица	мягкая кровля цена альметьевск	Монтаж гибкой черепицы	Идеальная крыша для дома	Профессиональная укладка гибкой (мягкой) черепицы от 1800 руб/м². Гарантия!	almetevsk.krovstroyrf.ru/uslugi/montazh-krovli-iz-gibkoj-cherepitsy?utm_source=yandex&utm_medium=cpc&utm_campaign=almetevsk_tenant1
-	Альметьевск - Гибкая черепица	укладка мягкой черепицы альметьевск	Монтаж гибкой черепицы	Идеальная крыша для дома	Профессиональная укладка гибкой (мягкой) черепицы от 1800 руб/м². Гарантия!	almetevsk.krovstroyrf.ru/uslugi/montazh-krovli-iz-gibkoj-cherepitsy?utm_source=yandex&utm_medium=cpc&utm_campaign=almetevsk_tenant1
