Доп. объявление	Название группы	Фраза (с минус-словами)	Заголовок 1	Заголовок 2	Текст	Ссылка
-	Балаково - Ремонт	ремонт кровли балаково	Ремонт крыши в Балаково	Гарантия до 39 лет!	Устраним протечки. Бесплатный замер за 2 мин. Опыт более 15 лет. Звоните!	balakovo.krovstroyrf.ru/uslugi/demontazh-i-remont-krovli?utm_source=yandex&utm_medium=cpc&utm_campaign=balakovo_tenant1
-	Балаково - Ремонт	ремонт крыши балаково	Ремонт крыши в Балаково	Гарантия до 39 лет!	Устраним протечки. Бесплатный замер за 2 мин. Опыт более 15 лет. Звоните!	balakovo.krovstroyrf.ru/uslugi/demontazh-i-remont-krovli?utm_source=yandex&utm_medium=cpc&utm_campaign=balakovo_tenant1
-	Балаково - Ремонт	демонтаж крыши балаково	Ремонт крыши в Балаково	Гарантия до 39 лет!	Устраним протечки. Бесплатный замер за 2 мин. Опыт более 15 лет. Звоните!	balakovo.krovstroyrf.ru/uslugi/demontazh-i-remont-krovli?utm_source=yandex&utm_medium=cpc&utm_campaign=balakovo_tenant1
-	Балаково - Ремонт	устранение протечек крыши балаково	Ремонт крыши в Балаково	Гарантия до 39 лет!	Устраним протечки. Бесплатный замер за 2 мин. Опыт более 15 лет. Звоните!	balakovo.krovstroyrf.ru/uslugi/demontazh-i-remont-krovli?utm_source=yandex&utm_medium=cpc&utm_campaign=balakovo_tenant1
-	Балаково - Ремонт	ремонт крыши частного дома балаково	Ремонт крыши в Балаково	Гарантия до 39 лет!	Устраним протечки. Бесплатный замер за 2 мин. Опыт более 15 лет. Звоните!	balakovo.krovstroyrf.ru/uslugi/demontazh-i-remont-krovli?utm_source=yandex&utm_medium=cpc&utm_campaign=balakovo_tenant1
-	Балаково - Монтаж	монтаж кровли балаково	Кровля под ключ в Балаково	Опытные кровельщики	Надежный монтаж кровли под ключ. Скидка 10% на материалы при заказе! Звони.	balakovo.krovstroyrf.ru/?utm_source=yandex&utm_medium=cpc&utm_campaign=balakovo_tenant1
-	Балаково - Монтаж	кровельные работы балаково	Кровля под ключ в Балаково	Опытные кровельщики	Надежный монтаж кровли под ключ. Скидка 10% на материалы при заказе! Звони.	balakovo.krovstroyrf.ru/?utm_source=yandex&utm_medium=cpc&utm_campaign=balakovo_tenant1
-	Балаково - Монтаж	крыша под ключ балаково	Кровля под ключ в Балаково	Опытные кровельщики	Надежный монтаж кровли под ключ. Скидка 10% на материалы при заказе! Звони.	balakovo.krovstroyrf.ru/?utm_source=yandex&utm_medium=cpc&utm_campaign=balakovo_tenant1
-	Балаково - Монтаж	перекрыть крышу балаково	Кровля под ключ в Балаково	Опытные кровельщики	Надежный монтаж кровли под ключ. Скидка 10% на материалы при заказе! Звони.	balakovo.krovstroyrf.ru/?utm_source=yandex&utm_medium=cpc&utm_campaign=balakovo_tenant1
-	Балаково - Монтаж	строительство крыши балаково	Кровля под ключ в Балаково	Опытные кровельщики	Надежный монтаж кровли под ключ. Скидка 10% на материалы при заказе! Звони.	balakovo.krovstroyrf.ru/?utm_source=yandex&utm_medium=cpc&utm_campaign=balakovo_tenant1
-	Балаково - Металлочерепица	монтаж металлочерепицы балаково	Монтаж металлочерепицы	От 1500 руб/м². Под ключ	Качественная кровля из металлочерепицы. Выезд замерщика бесплатно!	balakovo.krovstroyrf.ru/uslugi/montazh-krovli-iz-metallocherepitsy?utm_source=yandex&utm_medium=cpc&utm_campaign=balakovo_tenant1
-	Балаково - Металлочерепица	крыша из металлочерепицы балаково	Монтаж металлочерепицы	От 1500 руб/м². Под ключ	Качественная кровля из металлочерепицы. Выезд замерщика бесплатно!	balakovo.krovstroyrf.ru/uslugi/montazh-krovli-iz-metallocherepitsy?utm_source=yandex&utm_medium=cpc&utm_campaign=balakovo_tenant1
-	Балаково - Металлочерепица	металлочерепица под ключ балаково	Монтаж металлочерепицы	От 1500 руб/м². Под ключ	Качественная кровля из металлочерепицы. Выезд замерщика бесплатно!	balakovo.krovstroyrf.ru/uslugi/montazh-krovli-iz-metallocherepitsy?utm_source=yandex&utm_medium=cpc&utm_campaign=balakovo_tenant1
-	Балаково - Металлочерепица	кровля металлочерепица цена балаково	Монтаж металлочерепицы	От 1500 руб/м². Под ключ	Качественная кровля из металлочерепицы. Выезд замерщика бесплатно!	balakovo.krovstroyrf.ru/uslugi/montazh-krovli-iz-metallocherepitsy?utm_source=yandex&utm_medium=cpc&utm_campaign=balakovo_tenant1
-	Балаково - Профнастил	монтаж профнастила на крышу балаково	Кровля из профнастила	От 1400 руб/м² в Балаково	Надежный монтаж крыши из профнастила. Строго по договору без скрытых платежей.	balakovo.krovstroyrf.ru/uslugi/montazh-krovli-iz-profnastila?utm_source=yandex&utm_medium=cpc&utm_campaign=balakovo_tenant1
-	Балаково - Профнастил	крыша из профнастила балаково	Кровля из профнастила	От 1400 руб/м² в Балаково	Надежный монтаж крыши из профнастила. Строго по договору без скрытых платежей.	balakovo.krovstroyrf.ru/uslugi/montazh-krovli-iz-profnastila?utm_source=yandex&utm_medium=cpc&utm_campaign=balakovo_tenant1
-	Балаково - Профнастил	перекрыть крышу профлистом балаково	Кровля из профнастила	От 1400 руб/м² в Балаково	Надежный монтаж крыши из профнастила. Строго по договору без скрытых платежей.	balakovo.krovstroyrf.ru/uslugi/montazh-krovli-iz-profnastila?utm_source=yandex&utm_medium=cpc&utm_campaign=balakovo_tenant1
-	Балаково - Профнастил	кровля профнастил цена балаково	Кровля из профнастила	От 1400 руб/м² в Балаково	Надежный монтаж крыши из профнастила. Строго по договору без скрытых платежей.	balakovo.krovstroyrf.ru/uslugi/montazh-krovli-iz-profnastila?utm_source=yandex&utm_medium=cpc&utm_campaign=balakovo_tenant1
-	Балаково - Гибкая черепица	монтаж мягкой кровли балаково	Монтаж гибкой черепицы	Идеальная крыша для дома	Профессиональная укладка гибкой (мягкой) черепицы от 1800 руб/м². Гарантия!	balakovo.krovstroyrf.ru/uslugi/montazh-krovli-iz-gibkoj-cherepitsy?utm_source=yandex&utm_medium=cpc&utm_campaign=balakovo_tenant1
-	Балаково - Гибкая черепица	гибкая черепица монтаж балаково	Монтаж гибкой черепицы	Идеальная крыша для дома	Профессиональная укладка гибкой (мягкой) черепицы от 1800 руб/м². Гарантия!	balakovo.krovstroyrf.ru/uslugi/montazh-krovli-iz-gibkoj-cherepitsy?utm_source=yandex&utm_medium=cpc&utm_campaign=balakovo_tenant1
-	Балаково - Гибкая черепица	мягкая кровля цена балаково	Монтаж гибкой черепицы	Идеальная крыша для дома	Профессиональная укладка гибкой (мягкой) черепицы от 1800 руб/м². Гарантия!	balakovo.krovstroyrf.ru/uslugi/montazh-krovli-iz-gibkoj-cherepitsy?utm_source=yandex&utm_medium=cpc&utm_campaign=balakovo_tenant1
-	Балаково - Гибкая черепица	укладка мягкой черепицы балаково	Монтаж гибкой черепицы	Идеальная крыша для дома	Профессиональная укладка гибкой (мягкой) черепицы от 1800 руб/м². Гарантия!	balakovo.krovstroyrf.ru/uslugi/montazh-krovli-iz-gibkoj-cherepitsy?utm_source=yandex&utm_medium=cpc&utm_campaign=balakovo_tenant1
