Доп. объявление	Название группы	Фраза (с минус-словами)	Заголовок 1	Заголовок 2	Текст	Ссылка
-	Тюмень - Ремонт	ремонт кровли тюмень	Ремонт крыши в Тюмень	Гарантия до 39 лет!	Устраним протечки. Бесплатный замер за 2 мин. Опыт более 15 лет. Звоните!	tyumen.krovstroyrf.ru/uslugi/demontazh-i-remont-krovli?utm_source=yandex&utm_medium=cpc&utm_campaign=tyumen_tenant1
-	Тюмень - Ремонт	ремонт крыши тюмень	Ремонт крыши в Тюмень	Гарантия до 39 лет!	Устраним протечки. Бесплатный замер за 2 мин. Опыт более 15 лет. Звоните!	tyumen.krovstroyrf.ru/uslugi/demontazh-i-remont-krovli?utm_source=yandex&utm_medium=cpc&utm_campaign=tyumen_tenant1
-	Тюмень - Ремонт	демонтаж крыши тюмень	Ремонт крыши в Тюмень	Гарантия до 39 лет!	Устраним протечки. Бесплатный замер за 2 мин. Опыт более 15 лет. Звоните!	tyumen.krovstroyrf.ru/uslugi/demontazh-i-remont-krovli?utm_source=yandex&utm_medium=cpc&utm_campaign=tyumen_tenant1
-	Тюмень - Ремонт	устранение протечек крыши тюмень	Ремонт крыши в Тюмень	Гарантия до 39 лет!	Устраним протечки. Бесплатный замер за 2 мин. Опыт более 15 лет. Звоните!	tyumen.krovstroyrf.ru/uslugi/demontazh-i-remont-krovli?utm_source=yandex&utm_medium=cpc&utm_campaign=tyumen_tenant1
-	Тюмень - Ремонт	ремонт крыши частного дома тюмень	Ремонт крыши в Тюмень	Гарантия до 39 лет!	Устраним протечки. Бесплатный замер за 2 мин. Опыт более 15 лет. Звоните!	tyumen.krovstroyrf.ru/uslugi/demontazh-i-remont-krovli?utm_source=yandex&utm_medium=cpc&utm_campaign=tyumen_tenant1
-	Тюмень - Монтаж	монтаж кровли тюмень	Кровля под ключ в Тюмень	Опытные кровельщики	Надежный монтаж кровли под ключ. Скидка 10% на материалы при заказе! Звони.	tyumen.krovstroyrf.ru/?utm_source=yandex&utm_medium=cpc&utm_campaign=tyumen_tenant1
-	Тюмень - Монтаж	кровельные работы тюмень	Кровля под ключ в Тюмень	Опытные кровельщики	Надежный монтаж кровли под ключ. Скидка 10% на материалы при заказе! Звони.	tyumen.krovstroyrf.ru/?utm_source=yandex&utm_medium=cpc&utm_campaign=tyumen_tenant1
-	Тюмень - Монтаж	крыша под ключ тюмень	Кровля под ключ в Тюмень	Опытные кровельщики	Надежный монтаж кровли под ключ. Скидка 10% на материалы при заказе! Звони.	tyumen.krovstroyrf.ru/?utm_source=yandex&utm_medium=cpc&utm_campaign=tyumen_tenant1
-	Тюмень - Монтаж	перекрыть крышу тюмень	Кровля под ключ в Тюмень	Опытные кровельщики	Надежный монтаж кровли под ключ. Скидка 10% на материалы при заказе! Звони.	tyumen.krovstroyrf.ru/?utm_source=yandex&utm_medium=cpc&utm_campaign=tyumen_tenant1
-	Тюмень - Монтаж	строительство крыши тюмень	Кровля под ключ в Тюмень	Опытные кровельщики	Надежный монтаж кровли под ключ. Скидка 10% на материалы при заказе! Звони.	tyumen.krovstroyrf.ru/?utm_source=yandex&utm_medium=cpc&utm_campaign=tyumen_tenant1
-	Тюмень - Металлочерепица	монтаж металлочерепицы тюмень	Монтаж металлочерепицы	От 1500 руб/м². Под ключ	Качественная кровля из металлочерепицы. Выезд замерщика бесплатно!	tyumen.krovstroyrf.ru/uslugi/montazh-krovli-iz-metallocherepitsy?utm_source=yandex&utm_medium=cpc&utm_campaign=tyumen_tenant1
-	Тюмень - Металлочерепица	крыша из металлочерепицы тюмень	Монтаж металлочерепицы	От 1500 руб/м². Под ключ	Качественная кровля из металлочерепицы. Выезд замерщика бесплатно!	tyumen.krovstroyrf.ru/uslugi/montazh-krovli-iz-metallocherepitsy?utm_source=yandex&utm_medium=cpc&utm_campaign=tyumen_tenant1
-	Тюмень - Металлочерепица	металлочерепица под ключ тюмень	Монтаж металлочерепицы	От 1500 руб/м². Под ключ	Качественная кровля из металлочерепицы. Выезд замерщика бесплатно!	tyumen.krovstroyrf.ru/uslugi/montazh-krovli-iz-metallocherepitsy?utm_source=yandex&utm_medium=cpc&utm_campaign=tyumen_tenant1
-	Тюмень - Металлочерепица	кровля металлочерепица цена тюмень	Монтаж металлочерепицы	От 1500 руб/м². Под ключ	Качественная кровля из металлочерепицы. Выезд замерщика бесплатно!	tyumen.krovstroyrf.ru/uslugi/montazh-krovli-iz-metallocherepitsy?utm_source=yandex&utm_medium=cpc&utm_campaign=tyumen_tenant1
-	Тюмень - Профнастил	монтаж профнастила на крышу тюмень	Кровля из профнастила	От 1400 руб/м² в Тюмень	Надежный монтаж крыши из профнастила. Строго по договору без скрытых платежей.	tyumen.krovstroyrf.ru/uslugi/montazh-krovli-iz-profnastila?utm_source=yandex&utm_medium=cpc&utm_campaign=tyumen_tenant1
-	Тюмень - Профнастил	крыша из профнастила тюмень	Кровля из профнастила	От 1400 руб/м² в Тюмень	Надежный монтаж крыши из профнастила. Строго по договору без скрытых платежей.	tyumen.krovstroyrf.ru/uslugi/montazh-krovli-iz-profnastila?utm_source=yandex&utm_medium=cpc&utm_campaign=tyumen_tenant1
-	Тюмень - Профнастил	перекрыть крышу профлистом тюмень	Кровля из профнастила	От 1400 руб/м² в Тюмень	Надежный монтаж крыши из профнастила. Строго по договору без скрытых платежей.	tyumen.krovstroyrf.ru/uslugi/montazh-krovli-iz-profnastila?utm_source=yandex&utm_medium=cpc&utm_campaign=tyumen_tenant1
-	Тюмень - Профнастил	кровля профнастил цена тюмень	Кровля из профнастила	От 1400 руб/м² в Тюмень	Надежный монтаж крыши из профнастила. Строго по договору без скрытых платежей.	tyumen.krovstroyrf.ru/uslugi/montazh-krovli-iz-profnastila?utm_source=yandex&utm_medium=cpc&utm_campaign=tyumen_tenant1
-	Тюмень - Гибкая черепица	монтаж мягкой кровли тюмень	Монтаж гибкой черепицы	Идеальная крыша для дома	Профессиональная укладка гибкой (мягкой) черепицы от 1800 руб/м². Гарантия!	tyumen.krovstroyrf.ru/uslugi/montazh-krovli-iz-gibkoj-cherepitsy?utm_source=yandex&utm_medium=cpc&utm_campaign=tyumen_tenant1
-	Тюмень - Гибкая черепица	гибкая черепица монтаж тюмень	Монтаж гибкой черепицы	Идеальная крыша для дома	Профессиональная укладка гибкой (мягкой) черепицы от 1800 руб/м². Гарантия!	tyumen.krovstroyrf.ru/uslugi/montazh-krovli-iz-gibkoj-cherepitsy?utm_source=yandex&utm_medium=cpc&utm_campaign=tyumen_tenant1
-	Тюмень - Гибкая черепица	мягкая кровля цена тюмень	Монтаж гибкой черепицы	Идеальная крыша для дома	Профессиональная укладка гибкой (мягкой) черепицы от 1800 руб/м². Гарантия!	tyumen.krovstroyrf.ru/uslugi/montazh-krovli-iz-gibkoj-cherepitsy?utm_source=yandex&utm_medium=cpc&utm_campaign=tyumen_tenant1
-	Тюмень - Гибкая черепица	укладка мягкой черепицы тюмень	Монтаж гибкой черепицы	Идеальная крыша для дома	Профессиональная укладка гибкой (мягкой) черепицы от 1800 руб/м². Гарантия!	tyumen.krovstroyrf.ru/uslugi/montazh-krovli-iz-gibkoj-cherepitsy?utm_source=yandex&utm_medium=cpc&utm_campaign=tyumen_tenant1
