Доп. объявление	Название группы	Фраза (с минус-словами)	Заголовок 1	Заголовок 2	Текст	Ссылка
-	Рассказово - Ремонт	ремонт кровли рассказово	Ремонт крыши в Рассказово	Гарантия до 39 лет!	Устраним протечки. Бесплатный замер за 2 мин. Опыт более 15 лет. Звоните!	rasskazovo.krovstroyrf.ru/uslugi/demontazh-i-remont-krovli?utm_source=yandex&utm_medium=cpc&utm_campaign=rasskazovo_tenant1
-	Рассказово - Ремонт	ремонт крыши рассказово	Ремонт крыши в Рассказово	Гарантия до 39 лет!	Устраним протечки. Бесплатный замер за 2 мин. Опыт более 15 лет. Звоните!	rasskazovo.krovstroyrf.ru/uslugi/demontazh-i-remont-krovli?utm_source=yandex&utm_medium=cpc&utm_campaign=rasskazovo_tenant1
-	Рассказово - Ремонт	демонтаж крыши рассказово	Ремонт крыши в Рассказово	Гарантия до 39 лет!	Устраним протечки. Бесплатный замер за 2 мин. Опыт более 15 лет. Звоните!	rasskazovo.krovstroyrf.ru/uslugi/demontazh-i-remont-krovli?utm_source=yandex&utm_medium=cpc&utm_campaign=rasskazovo_tenant1
-	Рассказово - Ремонт	устранение протечек крыши рассказово	Ремонт крыши в Рассказово	Гарантия до 39 лет!	Устраним протечки. Бесплатный замер за 2 мин. Опыт более 15 лет. Звоните!	rasskazovo.krovstroyrf.ru/uslugi/demontazh-i-remont-krovli?utm_source=yandex&utm_medium=cpc&utm_campaign=rasskazovo_tenant1
-	Рассказово - Ремонт	ремонт крыши частного дома рассказово	Ремонт крыши в Рассказово	Гарантия до 39 лет!	Устраним протечки. Бесплатный замер за 2 мин. Опыт более 15 лет. Звоните!	rasskazovo.krovstroyrf.ru/uslugi/demontazh-i-remont-krovli?utm_source=yandex&utm_medium=cpc&utm_campaign=rasskazovo_tenant1
-	Рассказово - Монтаж	монтаж кровли рассказово	Кровля под ключ в Рассказово	Опытные кровельщики	Надежный монтаж кровли под ключ. Скидка 10% на материалы при заказе! Звони.	rasskazovo.krovstroyrf.ru/?utm_source=yandex&utm_medium=cpc&utm_campaign=rasskazovo_tenant1
-	Рассказово - Монтаж	кровельные работы рассказово	Кровля под ключ в Рассказово	Опытные кровельщики	Надежный монтаж кровли под ключ. Скидка 10% на материалы при заказе! Звони.	rasskazovo.krovstroyrf.ru/?utm_source=yandex&utm_medium=cpc&utm_campaign=rasskazovo_tenant1
-	Рассказово - Монтаж	крыша под ключ рассказово	Кровля под ключ в Рассказово	Опытные кровельщики	Надежный монтаж кровли под ключ. Скидка 10% на материалы при заказе! Звони.	rasskazovo.krovstroyrf.ru/?utm_source=yandex&utm_medium=cpc&utm_campaign=rasskazovo_tenant1
-	Рассказово - Монтаж	перекрыть крышу рассказово	Кровля под ключ в Рассказово	Опытные кровельщики	Надежный монтаж кровли под ключ. Скидка 10% на материалы при заказе! Звони.	rasskazovo.krovstroyrf.ru/?utm_source=yandex&utm_medium=cpc&utm_campaign=rasskazovo_tenant1
-	Рассказово - Монтаж	строительство крыши рассказово	Кровля под ключ в Рассказово	Опытные кровельщики	Надежный монтаж кровли под ключ. Скидка 10% на материалы при заказе! Звони.	rasskazovo.krovstroyrf.ru/?utm_source=yandex&utm_medium=cpc&utm_campaign=rasskazovo_tenant1
-	Рассказово - Металлочерепица	монтаж металлочерепицы рассказово	Монтаж металлочерепицы	От 1500 руб/м². Под ключ	Качественная кровля из металлочерепицы. Выезд замерщика бесплатно!	rasskazovo.krovstroyrf.ru/uslugi/montazh-krovli-iz-metallocherepitsy?utm_source=yandex&utm_medium=cpc&utm_campaign=rasskazovo_tenant1
-	Рассказово - Металлочерепица	крыша из металлочерепицы рассказово	Монтаж металлочерепицы	От 1500 руб/м². Под ключ	Качественная кровля из металлочерепицы. Выезд замерщика бесплатно!	rasskazovo.krovstroyrf.ru/uslugi/montazh-krovli-iz-metallocherepitsy?utm_source=yandex&utm_medium=cpc&utm_campaign=rasskazovo_tenant1
-	Рассказово - Металлочерепица	металлочерепица под ключ рассказово	Монтаж металлочерепицы	От 1500 руб/м². Под ключ	Качественная кровля из металлочерепицы. Выезд замерщика бесплатно!	rasskazovo.krovstroyrf.ru/uslugi/montazh-krovli-iz-metallocherepitsy?utm_source=yandex&utm_medium=cpc&utm_campaign=rasskazovo_tenant1
-	Рассказово - Металлочерепица	кровля металлочерепица цена рассказово	Монтаж металлочерепицы	От 1500 руб/м². Под ключ	Качественная кровля из металлочерепицы. Выезд замерщика бесплатно!	rasskazovo.krovstroyrf.ru/uslugi/montazh-krovli-iz-metallocherepitsy?utm_source=yandex&utm_medium=cpc&utm_campaign=rasskazovo_tenant1
-	Рассказово - Профнастил	монтаж профнастила на крышу рассказово	Кровля из профнастила	От 1400 руб/м² в Рассказово	Надежный монтаж крыши из профнастила. Строго по договору без скрытых платежей.	rasskazovo.krovstroyrf.ru/uslugi/montazh-krovli-iz-profnastila?utm_source=yandex&utm_medium=cpc&utm_campaign=rasskazovo_tenant1
-	Рассказово - Профнастил	крыша из профнастила рассказово	Кровля из профнастила	От 1400 руб/м² в Рассказово	Надежный монтаж крыши из профнастила. Строго по договору без скрытых платежей.	rasskazovo.krovstroyrf.ru/uslugi/montazh-krovli-iz-profnastila?utm_source=yandex&utm_medium=cpc&utm_campaign=rasskazovo_tenant1
-	Рассказово - Профнастил	перекрыть крышу профлистом рассказово	Кровля из профнастила	От 1400 руб/м² в Рассказово	Надежный монтаж крыши из профнастила. Строго по договору без скрытых платежей.	rasskazovo.krovstroyrf.ru/uslugi/montazh-krovli-iz-profnastila?utm_source=yandex&utm_medium=cpc&utm_campaign=rasskazovo_tenant1
-	Рассказово - Профнастил	кровля профнастил цена рассказово	Кровля из профнастила	От 1400 руб/м² в Рассказово	Надежный монтаж крыши из профнастила. Строго по договору без скрытых платежей.	rasskazovo.krovstroyrf.ru/uslugi/montazh-krovli-iz-profnastila?utm_source=yandex&utm_medium=cpc&utm_campaign=rasskazovo_tenant1
-	Рассказово - Гибкая черепица	монтаж мягкой кровли рассказово	Монтаж гибкой черепицы	Идеальная крыша для дома	Профессиональная укладка гибкой (мягкой) черепицы от 1800 руб/м². Гарантия!	rasskazovo.krovstroyrf.ru/uslugi/montazh-krovli-iz-gibkoj-cherepitsy?utm_source=yandex&utm_medium=cpc&utm_campaign=rasskazovo_tenant1
-	Рассказово - Гибкая черепица	гибкая черепица монтаж рассказово	Монтаж гибкой черепицы	Идеальная крыша для дома	Профессиональная укладка гибкой (мягкой) черепицы от 1800 руб/м². Гарантия!	rasskazovo.krovstroyrf.ru/uslugi/montazh-krovli-iz-gibkoj-cherepitsy?utm_source=yandex&utm_medium=cpc&utm_campaign=rasskazovo_tenant1
-	Рассказово - Гибкая черепица	мягкая кровля цена рассказово	Монтаж гибкой черепицы	Идеальная крыша для дома	Профессиональная укладка гибкой (мягкой) черепицы от 1800 руб/м². Гарантия!	rasskazovo.krovstroyrf.ru/uslugi/montazh-krovli-iz-gibkoj-cherepitsy?utm_source=yandex&utm_medium=cpc&utm_campaign=rasskazovo_tenant1
-	Рассказово - Гибкая черепица	укладка мягкой черепицы рассказово	Монтаж гибкой черепицы	Идеальная крыша для дома	Профессиональная укладка гибкой (мягкой) черепицы от 1800 руб/м². Гарантия!	rasskazovo.krovstroyrf.ru/uslugi/montazh-krovli-iz-gibkoj-cherepitsy?utm_source=yandex&utm_medium=cpc&utm_campaign=rasskazovo_tenant1
