Доп. объявление	Название группы	Фраза (с минус-словами)	Заголовок 1	Заголовок 2	Текст	Ссылка
-	Кандалакша - Ремонт	ремонт кровли кандалакша	Ремонт крыши в Кандалакша	Гарантия до 39 лет!	Устраним протечки. Бесплатный замер за 2 мин. Опыт более 15 лет. Звоните!	kandalaksha.krovstroyrf.ru/uslugi/demontazh-i-remont-krovli?utm_source=yandex&utm_medium=cpc&utm_campaign=kandalaksha_tenant1
-	Кандалакша - Ремонт	ремонт крыши кандалакша	Ремонт крыши в Кандалакша	Гарантия до 39 лет!	Устраним протечки. Бесплатный замер за 2 мин. Опыт более 15 лет. Звоните!	kandalaksha.krovstroyrf.ru/uslugi/demontazh-i-remont-krovli?utm_source=yandex&utm_medium=cpc&utm_campaign=kandalaksha_tenant1
-	Кандалакша - Ремонт	демонтаж крыши кандалакша	Ремонт крыши в Кандалакша	Гарантия до 39 лет!	Устраним протечки. Бесплатный замер за 2 мин. Опыт более 15 лет. Звоните!	kandalaksha.krovstroyrf.ru/uslugi/demontazh-i-remont-krovli?utm_source=yandex&utm_medium=cpc&utm_campaign=kandalaksha_tenant1
-	Кандалакша - Ремонт	устранение протечек крыши кандалакша	Ремонт крыши в Кандалакша	Гарантия до 39 лет!	Устраним протечки. Бесплатный замер за 2 мин. Опыт более 15 лет. Звоните!	kandalaksha.krovstroyrf.ru/uslugi/demontazh-i-remont-krovli?utm_source=yandex&utm_medium=cpc&utm_campaign=kandalaksha_tenant1
-	Кандалакша - Ремонт	ремонт крыши частного дома кандалакша	Ремонт крыши в Кандалакша	Гарантия до 39 лет!	Устраним протечки. Бесплатный замер за 2 мин. Опыт более 15 лет. Звоните!	kandalaksha.krovstroyrf.ru/uslugi/demontazh-i-remont-krovli?utm_source=yandex&utm_medium=cpc&utm_campaign=kandalaksha_tenant1
-	Кандалакша - Монтаж	монтаж кровли кандалакша	Кровля под ключ в Кандалакша	Опытные кровельщики	Надежный монтаж кровли под ключ. Скидка 10% на материалы при заказе! Звони.	kandalaksha.krovstroyrf.ru/?utm_source=yandex&utm_medium=cpc&utm_campaign=kandalaksha_tenant1
-	Кандалакша - Монтаж	кровельные работы кандалакша	Кровля под ключ в Кандалакша	Опытные кровельщики	Надежный монтаж кровли под ключ. Скидка 10% на материалы при заказе! Звони.	kandalaksha.krovstroyrf.ru/?utm_source=yandex&utm_medium=cpc&utm_campaign=kandalaksha_tenant1
-	Кандалакша - Монтаж	крыша под ключ кандалакша	Кровля под ключ в Кандалакша	Опытные кровельщики	Надежный монтаж кровли под ключ. Скидка 10% на материалы при заказе! Звони.	kandalaksha.krovstroyrf.ru/?utm_source=yandex&utm_medium=cpc&utm_campaign=kandalaksha_tenant1
-	Кандалакша - Монтаж	перекрыть крышу кандалакша	Кровля под ключ в Кандалакша	Опытные кровельщики	Надежный монтаж кровли под ключ. Скидка 10% на материалы при заказе! Звони.	kandalaksha.krovstroyrf.ru/?utm_source=yandex&utm_medium=cpc&utm_campaign=kandalaksha_tenant1
-	Кандалакша - Монтаж	строительство крыши кандалакша	Кровля под ключ в Кандалакша	Опытные кровельщики	Надежный монтаж кровли под ключ. Скидка 10% на материалы при заказе! Звони.	kandalaksha.krovstroyrf.ru/?utm_source=yandex&utm_medium=cpc&utm_campaign=kandalaksha_tenant1
-	Кандалакша - Металлочерепица	монтаж металлочерепицы кандалакша	Монтаж металлочерепицы	От 1500 руб/м². Под ключ	Качественная кровля из металлочерепицы. Выезд замерщика бесплатно!	kandalaksha.krovstroyrf.ru/uslugi/montazh-krovli-iz-metallocherepitsy?utm_source=yandex&utm_medium=cpc&utm_campaign=kandalaksha_tenant1
-	Кандалакша - Металлочерепица	крыша из металлочерепицы кандалакша	Монтаж металлочерепицы	От 1500 руб/м². Под ключ	Качественная кровля из металлочерепицы. Выезд замерщика бесплатно!	kandalaksha.krovstroyrf.ru/uslugi/montazh-krovli-iz-metallocherepitsy?utm_source=yandex&utm_medium=cpc&utm_campaign=kandalaksha_tenant1
-	Кандалакша - Металлочерепица	металлочерепица под ключ кандалакша	Монтаж металлочерепицы	От 1500 руб/м². Под ключ	Качественная кровля из металлочерепицы. Выезд замерщика бесплатно!	kandalaksha.krovstroyrf.ru/uslugi/montazh-krovli-iz-metallocherepitsy?utm_source=yandex&utm_medium=cpc&utm_campaign=kandalaksha_tenant1
-	Кандалакша - Металлочерепица	кровля металлочерепица цена кандалакша	Монтаж металлочерепицы	От 1500 руб/м². Под ключ	Качественная кровля из металлочерепицы. Выезд замерщика бесплатно!	kandalaksha.krovstroyrf.ru/uslugi/montazh-krovli-iz-metallocherepitsy?utm_source=yandex&utm_medium=cpc&utm_campaign=kandalaksha_tenant1
-	Кандалакша - Профнастил	монтаж профнастила на крышу кандалакша	Кровля из профнастила	От 1400 руб/м² в Кандалакша	Надежный монтаж крыши из профнастила. Строго по договору без скрытых платежей.	kandalaksha.krovstroyrf.ru/uslugi/montazh-krovli-iz-profnastila?utm_source=yandex&utm_medium=cpc&utm_campaign=kandalaksha_tenant1
-	Кандалакша - Профнастил	крыша из профнастила кандалакша	Кровля из профнастила	От 1400 руб/м² в Кандалакша	Надежный монтаж крыши из профнастила. Строго по договору без скрытых платежей.	kandalaksha.krovstroyrf.ru/uslugi/montazh-krovli-iz-profnastila?utm_source=yandex&utm_medium=cpc&utm_campaign=kandalaksha_tenant1
-	Кандалакша - Профнастил	перекрыть крышу профлистом кандалакша	Кровля из профнастила	От 1400 руб/м² в Кандалакша	Надежный монтаж крыши из профнастила. Строго по договору без скрытых платежей.	kandalaksha.krovstroyrf.ru/uslugi/montazh-krovli-iz-profnastila?utm_source=yandex&utm_medium=cpc&utm_campaign=kandalaksha_tenant1
-	Кандалакша - Профнастил	кровля профнастил цена кандалакша	Кровля из профнастила	От 1400 руб/м² в Кандалакша	Надежный монтаж крыши из профнастила. Строго по договору без скрытых платежей.	kandalaksha.krovstroyrf.ru/uslugi/montazh-krovli-iz-profnastila?utm_source=yandex&utm_medium=cpc&utm_campaign=kandalaksha_tenant1
-	Кандалакша - Гибкая черепица	монтаж мягкой кровли кандалакша	Монтаж гибкой черепицы	Идеальная крыша для дома	Профессиональная укладка гибкой (мягкой) черепицы от 1800 руб/м². Гарантия!	kandalaksha.krovstroyrf.ru/uslugi/montazh-krovli-iz-gibkoj-cherepitsy?utm_source=yandex&utm_medium=cpc&utm_campaign=kandalaksha_tenant1
-	Кандалакша - Гибкая черепица	гибкая черепица монтаж кандалакша	Монтаж гибкой черепицы	Идеальная крыша для дома	Профессиональная укладка гибкой (мягкой) черепицы от 1800 руб/м². Гарантия!	kandalaksha.krovstroyrf.ru/uslugi/montazh-krovli-iz-gibkoj-cherepitsy?utm_source=yandex&utm_medium=cpc&utm_campaign=kandalaksha_tenant1
-	Кандалакша - Гибкая черепица	мягкая кровля цена кандалакша	Монтаж гибкой черепицы	Идеальная крыша для дома	Профессиональная укладка гибкой (мягкой) черепицы от 1800 руб/м². Гарантия!	kandalaksha.krovstroyrf.ru/uslugi/montazh-krovli-iz-gibkoj-cherepitsy?utm_source=yandex&utm_medium=cpc&utm_campaign=kandalaksha_tenant1
-	Кандалакша - Гибкая черепица	укладка мягкой черепицы кандалакша	Монтаж гибкой черепицы	Идеальная крыша для дома	Профессиональная укладка гибкой (мягкой) черепицы от 1800 руб/м². Гарантия!	kandalaksha.krovstroyrf.ru/uslugi/montazh-krovli-iz-gibkoj-cherepitsy?utm_source=yandex&utm_medium=cpc&utm_campaign=kandalaksha_tenant1
