Доп. объявление	Название группы	Фраза (с минус-словами)	Заголовок 1	Заголовок 2	Текст	Ссылка
-	Невьянск - Ремонт	ремонт кровли невьянск	Ремонт крыши в Невьянск	Гарантия до 39 лет!	Устраним протечки. Бесплатный замер за 2 мин. Опыт более 15 лет. Звоните!	nevyansk.krovstroyrf.ru/uslugi/demontazh-i-remont-krovli?utm_source=yandex&utm_medium=cpc&utm_campaign=nevyansk_tenant1
-	Невьянск - Ремонт	ремонт крыши невьянск	Ремонт крыши в Невьянск	Гарантия до 39 лет!	Устраним протечки. Бесплатный замер за 2 мин. Опыт более 15 лет. Звоните!	nevyansk.krovstroyrf.ru/uslugi/demontazh-i-remont-krovli?utm_source=yandex&utm_medium=cpc&utm_campaign=nevyansk_tenant1
-	Невьянск - Ремонт	демонтаж крыши невьянск	Ремонт крыши в Невьянск	Гарантия до 39 лет!	Устраним протечки. Бесплатный замер за 2 мин. Опыт более 15 лет. Звоните!	nevyansk.krovstroyrf.ru/uslugi/demontazh-i-remont-krovli?utm_source=yandex&utm_medium=cpc&utm_campaign=nevyansk_tenant1
-	Невьянск - Ремонт	устранение протечек крыши невьянск	Ремонт крыши в Невьянск	Гарантия до 39 лет!	Устраним протечки. Бесплатный замер за 2 мин. Опыт более 15 лет. Звоните!	nevyansk.krovstroyrf.ru/uslugi/demontazh-i-remont-krovli?utm_source=yandex&utm_medium=cpc&utm_campaign=nevyansk_tenant1
-	Невьянск - Ремонт	ремонт крыши частного дома невьянск	Ремонт крыши в Невьянск	Гарантия до 39 лет!	Устраним протечки. Бесплатный замер за 2 мин. Опыт более 15 лет. Звоните!	nevyansk.krovstroyrf.ru/uslugi/demontazh-i-remont-krovli?utm_source=yandex&utm_medium=cpc&utm_campaign=nevyansk_tenant1
-	Невьянск - Монтаж	монтаж кровли невьянск	Кровля под ключ в Невьянск	Опытные кровельщики	Надежный монтаж кровли под ключ. Скидка 10% на материалы при заказе! Звони.	nevyansk.krovstroyrf.ru/?utm_source=yandex&utm_medium=cpc&utm_campaign=nevyansk_tenant1
-	Невьянск - Монтаж	кровельные работы невьянск	Кровля под ключ в Невьянск	Опытные кровельщики	Надежный монтаж кровли под ключ. Скидка 10% на материалы при заказе! Звони.	nevyansk.krovstroyrf.ru/?utm_source=yandex&utm_medium=cpc&utm_campaign=nevyansk_tenant1
-	Невьянск - Монтаж	крыша под ключ невьянск	Кровля под ключ в Невьянск	Опытные кровельщики	Надежный монтаж кровли под ключ. Скидка 10% на материалы при заказе! Звони.	nevyansk.krovstroyrf.ru/?utm_source=yandex&utm_medium=cpc&utm_campaign=nevyansk_tenant1
-	Невьянск - Монтаж	перекрыть крышу невьянск	Кровля под ключ в Невьянск	Опытные кровельщики	Надежный монтаж кровли под ключ. Скидка 10% на материалы при заказе! Звони.	nevyansk.krovstroyrf.ru/?utm_source=yandex&utm_medium=cpc&utm_campaign=nevyansk_tenant1
-	Невьянск - Монтаж	строительство крыши невьянск	Кровля под ключ в Невьянск	Опытные кровельщики	Надежный монтаж кровли под ключ. Скидка 10% на материалы при заказе! Звони.	nevyansk.krovstroyrf.ru/?utm_source=yandex&utm_medium=cpc&utm_campaign=nevyansk_tenant1
-	Невьянск - Металлочерепица	монтаж металлочерепицы невьянск	Монтаж металлочерепицы	От 1500 руб/м². Под ключ	Качественная кровля из металлочерепицы. Выезд замерщика бесплатно!	nevyansk.krovstroyrf.ru/uslugi/montazh-krovli-iz-metallocherepitsy?utm_source=yandex&utm_medium=cpc&utm_campaign=nevyansk_tenant1
-	Невьянск - Металлочерепица	крыша из металлочерепицы невьянск	Монтаж металлочерепицы	От 1500 руб/м². Под ключ	Качественная кровля из металлочерепицы. Выезд замерщика бесплатно!	nevyansk.krovstroyrf.ru/uslugi/montazh-krovli-iz-metallocherepitsy?utm_source=yandex&utm_medium=cpc&utm_campaign=nevyansk_tenant1
-	Невьянск - Металлочерепица	металлочерепица под ключ невьянск	Монтаж металлочерепицы	От 1500 руб/м². Под ключ	Качественная кровля из металлочерепицы. Выезд замерщика бесплатно!	nevyansk.krovstroyrf.ru/uslugi/montazh-krovli-iz-metallocherepitsy?utm_source=yandex&utm_medium=cpc&utm_campaign=nevyansk_tenant1
-	Невьянск - Металлочерепица	кровля металлочерепица цена невьянск	Монтаж металлочерепицы	От 1500 руб/м². Под ключ	Качественная кровля из металлочерепицы. Выезд замерщика бесплатно!	nevyansk.krovstroyrf.ru/uslugi/montazh-krovli-iz-metallocherepitsy?utm_source=yandex&utm_medium=cpc&utm_campaign=nevyansk_tenant1
-	Невьянск - Профнастил	монтаж профнастила на крышу невьянск	Кровля из профнастила	От 1400 руб/м² в Невьянск	Надежный монтаж крыши из профнастила. Строго по договору без скрытых платежей.	nevyansk.krovstroyrf.ru/uslugi/montazh-krovli-iz-profnastila?utm_source=yandex&utm_medium=cpc&utm_campaign=nevyansk_tenant1
-	Невьянск - Профнастил	крыша из профнастила невьянск	Кровля из профнастила	От 1400 руб/м² в Невьянск	Надежный монтаж крыши из профнастила. Строго по договору без скрытых платежей.	nevyansk.krovstroyrf.ru/uslugi/montazh-krovli-iz-profnastila?utm_source=yandex&utm_medium=cpc&utm_campaign=nevyansk_tenant1
-	Невьянск - Профнастил	перекрыть крышу профлистом невьянск	Кровля из профнастила	От 1400 руб/м² в Невьянск	Надежный монтаж крыши из профнастила. Строго по договору без скрытых платежей.	nevyansk.krovstroyrf.ru/uslugi/montazh-krovli-iz-profnastila?utm_source=yandex&utm_medium=cpc&utm_campaign=nevyansk_tenant1
-	Невьянск - Профнастил	кровля профнастил цена невьянск	Кровля из профнастила	От 1400 руб/м² в Невьянск	Надежный монтаж крыши из профнастила. Строго по договору без скрытых платежей.	nevyansk.krovstroyrf.ru/uslugi/montazh-krovli-iz-profnastila?utm_source=yandex&utm_medium=cpc&utm_campaign=nevyansk_tenant1
-	Невьянск - Гибкая черепица	монтаж мягкой кровли невьянск	Монтаж гибкой черепицы	Идеальная крыша для дома	Профессиональная укладка гибкой (мягкой) черепицы от 1800 руб/м². Гарантия!	nevyansk.krovstroyrf.ru/uslugi/montazh-krovli-iz-gibkoj-cherepitsy?utm_source=yandex&utm_medium=cpc&utm_campaign=nevyansk_tenant1
-	Невьянск - Гибкая черепица	гибкая черепица монтаж невьянск	Монтаж гибкой черепицы	Идеальная крыша для дома	Профессиональная укладка гибкой (мягкой) черепицы от 1800 руб/м². Гарантия!	nevyansk.krovstroyrf.ru/uslugi/montazh-krovli-iz-gibkoj-cherepitsy?utm_source=yandex&utm_medium=cpc&utm_campaign=nevyansk_tenant1
-	Невьянск - Гибкая черепица	мягкая кровля цена невьянск	Монтаж гибкой черепицы	Идеальная крыша для дома	Профессиональная укладка гибкой (мягкой) черепицы от 1800 руб/м². Гарантия!	nevyansk.krovstroyrf.ru/uslugi/montazh-krovli-iz-gibkoj-cherepitsy?utm_source=yandex&utm_medium=cpc&utm_campaign=nevyansk_tenant1
-	Невьянск - Гибкая черепица	укладка мягкой черепицы невьянск	Монтаж гибкой черепицы	Идеальная крыша для дома	Профессиональная укладка гибкой (мягкой) черепицы от 1800 руб/м². Гарантия!	nevyansk.krovstroyrf.ru/uslugi/montazh-krovli-iz-gibkoj-cherepitsy?utm_source=yandex&utm_medium=cpc&utm_campaign=nevyansk_tenant1
