Доп. объявление	Название группы	Фраза (с минус-словами)	Заголовок 1	Заголовок 2	Текст	Ссылка
-	Омск - Ремонт	ремонт кровли омск	Ремонт крыши в Омск	Гарантия до 39 лет!	Устраним протечки. Бесплатный замер за 2 мин. Опыт более 15 лет. Звоните!	omsk.krovstroyrf.ru/uslugi/demontazh-i-remont-krovli?utm_source=yandex&utm_medium=cpc&utm_campaign=omsk_tenant1
-	Омск - Ремонт	ремонт крыши омск	Ремонт крыши в Омск	Гарантия до 39 лет!	Устраним протечки. Бесплатный замер за 2 мин. Опыт более 15 лет. Звоните!	omsk.krovstroyrf.ru/uslugi/demontazh-i-remont-krovli?utm_source=yandex&utm_medium=cpc&utm_campaign=omsk_tenant1
-	Омск - Ремонт	демонтаж крыши омск	Ремонт крыши в Омск	Гарантия до 39 лет!	Устраним протечки. Бесплатный замер за 2 мин. Опыт более 15 лет. Звоните!	omsk.krovstroyrf.ru/uslugi/demontazh-i-remont-krovli?utm_source=yandex&utm_medium=cpc&utm_campaign=omsk_tenant1
-	Омск - Ремонт	устранение протечек крыши омск	Ремонт крыши в Омск	Гарантия до 39 лет!	Устраним протечки. Бесплатный замер за 2 мин. Опыт более 15 лет. Звоните!	omsk.krovstroyrf.ru/uslugi/demontazh-i-remont-krovli?utm_source=yandex&utm_medium=cpc&utm_campaign=omsk_tenant1
-	Омск - Ремонт	ремонт крыши частного дома омск	Ремонт крыши в Омск	Гарантия до 39 лет!	Устраним протечки. Бесплатный замер за 2 мин. Опыт более 15 лет. Звоните!	omsk.krovstroyrf.ru/uslugi/demontazh-i-remont-krovli?utm_source=yandex&utm_medium=cpc&utm_campaign=omsk_tenant1
-	Омск - Монтаж	монтаж кровли омск	Кровля под ключ в Омск	Опытные кровельщики	Надежный монтаж кровли под ключ. Скидка 10% на материалы при заказе! Звони.	omsk.krovstroyrf.ru/?utm_source=yandex&utm_medium=cpc&utm_campaign=omsk_tenant1
-	Омск - Монтаж	кровельные работы омск	Кровля под ключ в Омск	Опытные кровельщики	Надежный монтаж кровли под ключ. Скидка 10% на материалы при заказе! Звони.	omsk.krovstroyrf.ru/?utm_source=yandex&utm_medium=cpc&utm_campaign=omsk_tenant1
-	Омск - Монтаж	крыша под ключ омск	Кровля под ключ в Омск	Опытные кровельщики	Надежный монтаж кровли под ключ. Скидка 10% на материалы при заказе! Звони.	omsk.krovstroyrf.ru/?utm_source=yandex&utm_medium=cpc&utm_campaign=omsk_tenant1
-	Омск - Монтаж	перекрыть крышу омск	Кровля под ключ в Омск	Опытные кровельщики	Надежный монтаж кровли под ключ. Скидка 10% на материалы при заказе! Звони.	omsk.krovstroyrf.ru/?utm_source=yandex&utm_medium=cpc&utm_campaign=omsk_tenant1
-	Омск - Монтаж	строительство крыши омск	Кровля под ключ в Омск	Опытные кровельщики	Надежный монтаж кровли под ключ. Скидка 10% на материалы при заказе! Звони.	omsk.krovstroyrf.ru/?utm_source=yandex&utm_medium=cpc&utm_campaign=omsk_tenant1
-	Омск - Металлочерепица	монтаж металлочерепицы омск	Монтаж металлочерепицы	От 1500 руб/м². Под ключ	Качественная кровля из металлочерепицы. Выезд замерщика бесплатно!	omsk.krovstroyrf.ru/uslugi/montazh-krovli-iz-metallocherepitsy?utm_source=yandex&utm_medium=cpc&utm_campaign=omsk_tenant1
-	Омск - Металлочерепица	крыша из металлочерепицы омск	Монтаж металлочерепицы	От 1500 руб/м². Под ключ	Качественная кровля из металлочерепицы. Выезд замерщика бесплатно!	omsk.krovstroyrf.ru/uslugi/montazh-krovli-iz-metallocherepitsy?utm_source=yandex&utm_medium=cpc&utm_campaign=omsk_tenant1
-	Омск - Металлочерепица	металлочерепица под ключ омск	Монтаж металлочерепицы	От 1500 руб/м². Под ключ	Качественная кровля из металлочерепицы. Выезд замерщика бесплатно!	omsk.krovstroyrf.ru/uslugi/montazh-krovli-iz-metallocherepitsy?utm_source=yandex&utm_medium=cpc&utm_campaign=omsk_tenant1
-	Омск - Металлочерепица	кровля металлочерепица цена омск	Монтаж металлочерепицы	От 1500 руб/м². Под ключ	Качественная кровля из металлочерепицы. Выезд замерщика бесплатно!	omsk.krovstroyrf.ru/uslugi/montazh-krovli-iz-metallocherepitsy?utm_source=yandex&utm_medium=cpc&utm_campaign=omsk_tenant1
-	Омск - Профнастил	монтаж профнастила на крышу омск	Кровля из профнастила	От 1400 руб/м² в Омск	Надежный монтаж крыши из профнастила. Строго по договору без скрытых платежей.	omsk.krovstroyrf.ru/uslugi/montazh-krovli-iz-profnastila?utm_source=yandex&utm_medium=cpc&utm_campaign=omsk_tenant1
-	Омск - Профнастил	крыша из профнастила омск	Кровля из профнастила	От 1400 руб/м² в Омск	Надежный монтаж крыши из профнастила. Строго по договору без скрытых платежей.	omsk.krovstroyrf.ru/uslugi/montazh-krovli-iz-profnastila?utm_source=yandex&utm_medium=cpc&utm_campaign=omsk_tenant1
-	Омск - Профнастил	перекрыть крышу профлистом омск	Кровля из профнастила	От 1400 руб/м² в Омск	Надежный монтаж крыши из профнастила. Строго по договору без скрытых платежей.	omsk.krovstroyrf.ru/uslugi/montazh-krovli-iz-profnastila?utm_source=yandex&utm_medium=cpc&utm_campaign=omsk_tenant1
-	Омск - Профнастил	кровля профнастил цена омск	Кровля из профнастила	От 1400 руб/м² в Омск	Надежный монтаж крыши из профнастила. Строго по договору без скрытых платежей.	omsk.krovstroyrf.ru/uslugi/montazh-krovli-iz-profnastila?utm_source=yandex&utm_medium=cpc&utm_campaign=omsk_tenant1
-	Омск - Гибкая черепица	монтаж мягкой кровли омск	Монтаж гибкой черепицы	Идеальная крыша для дома	Профессиональная укладка гибкой (мягкой) черепицы от 1800 руб/м². Гарантия!	omsk.krovstroyrf.ru/uslugi/montazh-krovli-iz-gibkoj-cherepitsy?utm_source=yandex&utm_medium=cpc&utm_campaign=omsk_tenant1
-	Омск - Гибкая черепица	гибкая черепица монтаж омск	Монтаж гибкой черепицы	Идеальная крыша для дома	Профессиональная укладка гибкой (мягкой) черепицы от 1800 руб/м². Гарантия!	omsk.krovstroyrf.ru/uslugi/montazh-krovli-iz-gibkoj-cherepitsy?utm_source=yandex&utm_medium=cpc&utm_campaign=omsk_tenant1
-	Омск - Гибкая черепица	мягкая кровля цена омск	Монтаж гибкой черепицы	Идеальная крыша для дома	Профессиональная укладка гибкой (мягкой) черепицы от 1800 руб/м². Гарантия!	omsk.krovstroyrf.ru/uslugi/montazh-krovli-iz-gibkoj-cherepitsy?utm_source=yandex&utm_medium=cpc&utm_campaign=omsk_tenant1
-	Омск - Гибкая черепица	укладка мягкой черепицы омск	Монтаж гибкой черепицы	Идеальная крыша для дома	Профессиональная укладка гибкой (мягкой) черепицы от 1800 руб/м². Гарантия!	omsk.krovstroyrf.ru/uslugi/montazh-krovli-iz-gibkoj-cherepitsy?utm_source=yandex&utm_medium=cpc&utm_campaign=omsk_tenant1
