Доп. объявление	Название группы	Фраза (с минус-словами)	Заголовок 1	Заголовок 2	Текст	Ссылка
-	Хасавюрт - Ремонт	ремонт кровли хасавюрт	Ремонт крыши в Хасавюрт	Гарантия до 39 лет!	Устраним протечки. Бесплатный замер за 2 мин. Опыт более 15 лет. Звоните!	khasavyurt.krovstroyrf.ru/uslugi/demontazh-i-remont-krovli?utm_source=yandex&utm_medium=cpc&utm_campaign=khasavyurt_tenant1
-	Хасавюрт - Ремонт	ремонт крыши хасавюрт	Ремонт крыши в Хасавюрт	Гарантия до 39 лет!	Устраним протечки. Бесплатный замер за 2 мин. Опыт более 15 лет. Звоните!	khasavyurt.krovstroyrf.ru/uslugi/demontazh-i-remont-krovli?utm_source=yandex&utm_medium=cpc&utm_campaign=khasavyurt_tenant1
-	Хасавюрт - Ремонт	демонтаж крыши хасавюрт	Ремонт крыши в Хасавюрт	Гарантия до 39 лет!	Устраним протечки. Бесплатный замер за 2 мин. Опыт более 15 лет. Звоните!	khasavyurt.krovstroyrf.ru/uslugi/demontazh-i-remont-krovli?utm_source=yandex&utm_medium=cpc&utm_campaign=khasavyurt_tenant1
-	Хасавюрт - Ремонт	устранение протечек крыши хасавюрт	Ремонт крыши в Хасавюрт	Гарантия до 39 лет!	Устраним протечки. Бесплатный замер за 2 мин. Опыт более 15 лет. Звоните!	khasavyurt.krovstroyrf.ru/uslugi/demontazh-i-remont-krovli?utm_source=yandex&utm_medium=cpc&utm_campaign=khasavyurt_tenant1
-	Хасавюрт - Ремонт	ремонт крыши частного дома хасавюрт	Ремонт крыши в Хасавюрт	Гарантия до 39 лет!	Устраним протечки. Бесплатный замер за 2 мин. Опыт более 15 лет. Звоните!	khasavyurt.krovstroyrf.ru/uslugi/demontazh-i-remont-krovli?utm_source=yandex&utm_medium=cpc&utm_campaign=khasavyurt_tenant1
-	Хасавюрт - Монтаж	монтаж кровли хасавюрт	Кровля под ключ в Хасавюрт	Опытные кровельщики	Надежный монтаж кровли под ключ. Скидка 10% на материалы при заказе! Звони.	khasavyurt.krovstroyrf.ru/?utm_source=yandex&utm_medium=cpc&utm_campaign=khasavyurt_tenant1
-	Хасавюрт - Монтаж	кровельные работы хасавюрт	Кровля под ключ в Хасавюрт	Опытные кровельщики	Надежный монтаж кровли под ключ. Скидка 10% на материалы при заказе! Звони.	khasavyurt.krovstroyrf.ru/?utm_source=yandex&utm_medium=cpc&utm_campaign=khasavyurt_tenant1
-	Хасавюрт - Монтаж	крыша под ключ хасавюрт	Кровля под ключ в Хасавюрт	Опытные кровельщики	Надежный монтаж кровли под ключ. Скидка 10% на материалы при заказе! Звони.	khasavyurt.krovstroyrf.ru/?utm_source=yandex&utm_medium=cpc&utm_campaign=khasavyurt_tenant1
-	Хасавюрт - Монтаж	перекрыть крышу хасавюрт	Кровля под ключ в Хасавюрт	Опытные кровельщики	Надежный монтаж кровли под ключ. Скидка 10% на материалы при заказе! Звони.	khasavyurt.krovstroyrf.ru/?utm_source=yandex&utm_medium=cpc&utm_campaign=khasavyurt_tenant1
-	Хасавюрт - Монтаж	строительство крыши хасавюрт	Кровля под ключ в Хасавюрт	Опытные кровельщики	Надежный монтаж кровли под ключ. Скидка 10% на материалы при заказе! Звони.	khasavyurt.krovstroyrf.ru/?utm_source=yandex&utm_medium=cpc&utm_campaign=khasavyurt_tenant1
-	Хасавюрт - Металлочерепица	монтаж металлочерепицы хасавюрт	Монтаж металлочерепицы	От 1500 руб/м². Под ключ	Качественная кровля из металлочерепицы. Выезд замерщика бесплатно!	khasavyurt.krovstroyrf.ru/uslugi/montazh-krovli-iz-metallocherepitsy?utm_source=yandex&utm_medium=cpc&utm_campaign=khasavyurt_tenant1
-	Хасавюрт - Металлочерепица	крыша из металлочерепицы хасавюрт	Монтаж металлочерепицы	От 1500 руб/м². Под ключ	Качественная кровля из металлочерепицы. Выезд замерщика бесплатно!	khasavyurt.krovstroyrf.ru/uslugi/montazh-krovli-iz-metallocherepitsy?utm_source=yandex&utm_medium=cpc&utm_campaign=khasavyurt_tenant1
-	Хасавюрт - Металлочерепица	металлочерепица под ключ хасавюрт	Монтаж металлочерепицы	От 1500 руб/м². Под ключ	Качественная кровля из металлочерепицы. Выезд замерщика бесплатно!	khasavyurt.krovstroyrf.ru/uslugi/montazh-krovli-iz-metallocherepitsy?utm_source=yandex&utm_medium=cpc&utm_campaign=khasavyurt_tenant1
-	Хасавюрт - Металлочерепица	кровля металлочерепица цена хасавюрт	Монтаж металлочерепицы	От 1500 руб/м². Под ключ	Качественная кровля из металлочерепицы. Выезд замерщика бесплатно!	khasavyurt.krovstroyrf.ru/uslugi/montazh-krovli-iz-metallocherepitsy?utm_source=yandex&utm_medium=cpc&utm_campaign=khasavyurt_tenant1
-	Хасавюрт - Профнастил	монтаж профнастила на крышу хасавюрт	Кровля из профнастила	От 1400 руб/м² в Хасавюрт	Надежный монтаж крыши из профнастила. Строго по договору без скрытых платежей.	khasavyurt.krovstroyrf.ru/uslugi/montazh-krovli-iz-profnastila?utm_source=yandex&utm_medium=cpc&utm_campaign=khasavyurt_tenant1
-	Хасавюрт - Профнастил	крыша из профнастила хасавюрт	Кровля из профнастила	От 1400 руб/м² в Хасавюрт	Надежный монтаж крыши из профнастила. Строго по договору без скрытых платежей.	khasavyurt.krovstroyrf.ru/uslugi/montazh-krovli-iz-profnastila?utm_source=yandex&utm_medium=cpc&utm_campaign=khasavyurt_tenant1
-	Хасавюрт - Профнастил	перекрыть крышу профлистом хасавюрт	Кровля из профнастила	От 1400 руб/м² в Хасавюрт	Надежный монтаж крыши из профнастила. Строго по договору без скрытых платежей.	khasavyurt.krovstroyrf.ru/uslugi/montazh-krovli-iz-profnastila?utm_source=yandex&utm_medium=cpc&utm_campaign=khasavyurt_tenant1
-	Хасавюрт - Профнастил	кровля профнастил цена хасавюрт	Кровля из профнастила	От 1400 руб/м² в Хасавюрт	Надежный монтаж крыши из профнастила. Строго по договору без скрытых платежей.	khasavyurt.krovstroyrf.ru/uslugi/montazh-krovli-iz-profnastila?utm_source=yandex&utm_medium=cpc&utm_campaign=khasavyurt_tenant1
-	Хасавюрт - Гибкая черепица	монтаж мягкой кровли хасавюрт	Монтаж гибкой черепицы	Идеальная крыша для дома	Профессиональная укладка гибкой (мягкой) черепицы от 1800 руб/м². Гарантия!	khasavyurt.krovstroyrf.ru/uslugi/montazh-krovli-iz-gibkoj-cherepitsy?utm_source=yandex&utm_medium=cpc&utm_campaign=khasavyurt_tenant1
-	Хасавюрт - Гибкая черепица	гибкая черепица монтаж хасавюрт	Монтаж гибкой черепицы	Идеальная крыша для дома	Профессиональная укладка гибкой (мягкой) черепицы от 1800 руб/м². Гарантия!	khasavyurt.krovstroyrf.ru/uslugi/montazh-krovli-iz-gibkoj-cherepitsy?utm_source=yandex&utm_medium=cpc&utm_campaign=khasavyurt_tenant1
-	Хасавюрт - Гибкая черепица	мягкая кровля цена хасавюрт	Монтаж гибкой черепицы	Идеальная крыша для дома	Профессиональная укладка гибкой (мягкой) черепицы от 1800 руб/м². Гарантия!	khasavyurt.krovstroyrf.ru/uslugi/montazh-krovli-iz-gibkoj-cherepitsy?utm_source=yandex&utm_medium=cpc&utm_campaign=khasavyurt_tenant1
-	Хасавюрт - Гибкая черепица	укладка мягкой черепицы хасавюрт	Монтаж гибкой черепицы	Идеальная крыша для дома	Профессиональная укладка гибкой (мягкой) черепицы от 1800 руб/м². Гарантия!	khasavyurt.krovstroyrf.ru/uslugi/montazh-krovli-iz-gibkoj-cherepitsy?utm_source=yandex&utm_medium=cpc&utm_campaign=khasavyurt_tenant1
