Доп. объявление	Название группы	Фраза (с минус-словами)	Заголовок 1	Заголовок 2	Текст	Ссылка
-	Астрахань - Ремонт	ремонт кровли астрахань	Ремонт крыши в Астрахань	Гарантия до 39 лет!	Устраним протечки. Бесплатный замер за 2 мин. Опыт более 15 лет. Звоните!	astrakhan.krovstroyrf.ru/uslugi/demontazh-i-remont-krovli?utm_source=yandex&utm_medium=cpc&utm_campaign=astrakhan_tenant1
-	Астрахань - Ремонт	ремонт крыши астрахань	Ремонт крыши в Астрахань	Гарантия до 39 лет!	Устраним протечки. Бесплатный замер за 2 мин. Опыт более 15 лет. Звоните!	astrakhan.krovstroyrf.ru/uslugi/demontazh-i-remont-krovli?utm_source=yandex&utm_medium=cpc&utm_campaign=astrakhan_tenant1
-	Астрахань - Ремонт	демонтаж крыши астрахань	Ремонт крыши в Астрахань	Гарантия до 39 лет!	Устраним протечки. Бесплатный замер за 2 мин. Опыт более 15 лет. Звоните!	astrakhan.krovstroyrf.ru/uslugi/demontazh-i-remont-krovli?utm_source=yandex&utm_medium=cpc&utm_campaign=astrakhan_tenant1
-	Астрахань - Ремонт	устранение протечек крыши астрахань	Ремонт крыши в Астрахань	Гарантия до 39 лет!	Устраним протечки. Бесплатный замер за 2 мин. Опыт более 15 лет. Звоните!	astrakhan.krovstroyrf.ru/uslugi/demontazh-i-remont-krovli?utm_source=yandex&utm_medium=cpc&utm_campaign=astrakhan_tenant1
-	Астрахань - Ремонт	ремонт крыши частного дома астрахань	Ремонт крыши в Астрахань	Гарантия до 39 лет!	Устраним протечки. Бесплатный замер за 2 мин. Опыт более 15 лет. Звоните!	astrakhan.krovstroyrf.ru/uslugi/demontazh-i-remont-krovli?utm_source=yandex&utm_medium=cpc&utm_campaign=astrakhan_tenant1
-	Астрахань - Монтаж	монтаж кровли астрахань	Кровля под ключ в Астрахань	Опытные кровельщики	Надежный монтаж кровли под ключ. Скидка 10% на материалы при заказе! Звони.	astrakhan.krovstroyrf.ru/?utm_source=yandex&utm_medium=cpc&utm_campaign=astrakhan_tenant1
-	Астрахань - Монтаж	кровельные работы астрахань	Кровля под ключ в Астрахань	Опытные кровельщики	Надежный монтаж кровли под ключ. Скидка 10% на материалы при заказе! Звони.	astrakhan.krovstroyrf.ru/?utm_source=yandex&utm_medium=cpc&utm_campaign=astrakhan_tenant1
-	Астрахань - Монтаж	крыша под ключ астрахань	Кровля под ключ в Астрахань	Опытные кровельщики	Надежный монтаж кровли под ключ. Скидка 10% на материалы при заказе! Звони.	astrakhan.krovstroyrf.ru/?utm_source=yandex&utm_medium=cpc&utm_campaign=astrakhan_tenant1
-	Астрахань - Монтаж	перекрыть крышу астрахань	Кровля под ключ в Астрахань	Опытные кровельщики	Надежный монтаж кровли под ключ. Скидка 10% на материалы при заказе! Звони.	astrakhan.krovstroyrf.ru/?utm_source=yandex&utm_medium=cpc&utm_campaign=astrakhan_tenant1
-	Астрахань - Монтаж	строительство крыши астрахань	Кровля под ключ в Астрахань	Опытные кровельщики	Надежный монтаж кровли под ключ. Скидка 10% на материалы при заказе! Звони.	astrakhan.krovstroyrf.ru/?utm_source=yandex&utm_medium=cpc&utm_campaign=astrakhan_tenant1
-	Астрахань - Металлочерепица	монтаж металлочерепицы астрахань	Монтаж металлочерепицы	От 1500 руб/м². Под ключ	Качественная кровля из металлочерепицы. Выезд замерщика бесплатно!	astrakhan.krovstroyrf.ru/uslugi/montazh-krovli-iz-metallocherepitsy?utm_source=yandex&utm_medium=cpc&utm_campaign=astrakhan_tenant1
-	Астрахань - Металлочерепица	крыша из металлочерепицы астрахань	Монтаж металлочерепицы	От 1500 руб/м². Под ключ	Качественная кровля из металлочерепицы. Выезд замерщика бесплатно!	astrakhan.krovstroyrf.ru/uslugi/montazh-krovli-iz-metallocherepitsy?utm_source=yandex&utm_medium=cpc&utm_campaign=astrakhan_tenant1
-	Астрахань - Металлочерепица	металлочерепица под ключ астрахань	Монтаж металлочерепицы	От 1500 руб/м². Под ключ	Качественная кровля из металлочерепицы. Выезд замерщика бесплатно!	astrakhan.krovstroyrf.ru/uslugi/montazh-krovli-iz-metallocherepitsy?utm_source=yandex&utm_medium=cpc&utm_campaign=astrakhan_tenant1
-	Астрахань - Металлочерепица	кровля металлочерепица цена астрахань	Монтаж металлочерепицы	От 1500 руб/м². Под ключ	Качественная кровля из металлочерепицы. Выезд замерщика бесплатно!	astrakhan.krovstroyrf.ru/uslugi/montazh-krovli-iz-metallocherepitsy?utm_source=yandex&utm_medium=cpc&utm_campaign=astrakhan_tenant1
-	Астрахань - Профнастил	монтаж профнастила на крышу астрахань	Кровля из профнастила	От 1400 руб/м² в Астрахань	Надежный монтаж крыши из профнастила. Строго по договору без скрытых платежей.	astrakhan.krovstroyrf.ru/uslugi/montazh-krovli-iz-profnastila?utm_source=yandex&utm_medium=cpc&utm_campaign=astrakhan_tenant1
-	Астрахань - Профнастил	крыша из профнастила астрахань	Кровля из профнастила	От 1400 руб/м² в Астрахань	Надежный монтаж крыши из профнастила. Строго по договору без скрытых платежей.	astrakhan.krovstroyrf.ru/uslugi/montazh-krovli-iz-profnastila?utm_source=yandex&utm_medium=cpc&utm_campaign=astrakhan_tenant1
-	Астрахань - Профнастил	перекрыть крышу профлистом астрахань	Кровля из профнастила	От 1400 руб/м² в Астрахань	Надежный монтаж крыши из профнастила. Строго по договору без скрытых платежей.	astrakhan.krovstroyrf.ru/uslugi/montazh-krovli-iz-profnastila?utm_source=yandex&utm_medium=cpc&utm_campaign=astrakhan_tenant1
-	Астрахань - Профнастил	кровля профнастил цена астрахань	Кровля из профнастила	От 1400 руб/м² в Астрахань	Надежный монтаж крыши из профнастила. Строго по договору без скрытых платежей.	astrakhan.krovstroyrf.ru/uslugi/montazh-krovli-iz-profnastila?utm_source=yandex&utm_medium=cpc&utm_campaign=astrakhan_tenant1
-	Астрахань - Гибкая черепица	монтаж мягкой кровли астрахань	Монтаж гибкой черепицы	Идеальная крыша для дома	Профессиональная укладка гибкой (мягкой) черепицы от 1800 руб/м². Гарантия!	astrakhan.krovstroyrf.ru/uslugi/montazh-krovli-iz-gibkoj-cherepitsy?utm_source=yandex&utm_medium=cpc&utm_campaign=astrakhan_tenant1
-	Астрахань - Гибкая черепица	гибкая черепица монтаж астрахань	Монтаж гибкой черепицы	Идеальная крыша для дома	Профессиональная укладка гибкой (мягкой) черепицы от 1800 руб/м². Гарантия!	astrakhan.krovstroyrf.ru/uslugi/montazh-krovli-iz-gibkoj-cherepitsy?utm_source=yandex&utm_medium=cpc&utm_campaign=astrakhan_tenant1
-	Астрахань - Гибкая черепица	мягкая кровля цена астрахань	Монтаж гибкой черепицы	Идеальная крыша для дома	Профессиональная укладка гибкой (мягкой) черепицы от 1800 руб/м². Гарантия!	astrakhan.krovstroyrf.ru/uslugi/montazh-krovli-iz-gibkoj-cherepitsy?utm_source=yandex&utm_medium=cpc&utm_campaign=astrakhan_tenant1
-	Астрахань - Гибкая черепица	укладка мягкой черепицы астрахань	Монтаж гибкой черепицы	Идеальная крыша для дома	Профессиональная укладка гибкой (мягкой) черепицы от 1800 руб/м². Гарантия!	astrakhan.krovstroyrf.ru/uslugi/montazh-krovli-iz-gibkoj-cherepitsy?utm_source=yandex&utm_medium=cpc&utm_campaign=astrakhan_tenant1
