Доп. объявление	Название группы	Фраза (с минус-словами)	Заголовок 1	Заголовок 2	Текст	Ссылка
-	Нальчик - Ремонт	ремонт кровли нальчик	Ремонт крыши в Нальчик	Гарантия до 39 лет!	Устраним протечки. Бесплатный замер за 2 мин. Опыт более 15 лет. Звоните!	nalchik.krovstroyrf.ru/uslugi/demontazh-i-remont-krovli?utm_source=yandex&utm_medium=cpc&utm_campaign=nalchik_tenant1
-	Нальчик - Ремонт	ремонт крыши нальчик	Ремонт крыши в Нальчик	Гарантия до 39 лет!	Устраним протечки. Бесплатный замер за 2 мин. Опыт более 15 лет. Звоните!	nalchik.krovstroyrf.ru/uslugi/demontazh-i-remont-krovli?utm_source=yandex&utm_medium=cpc&utm_campaign=nalchik_tenant1
-	Нальчик - Ремонт	демонтаж крыши нальчик	Ремонт крыши в Нальчик	Гарантия до 39 лет!	Устраним протечки. Бесплатный замер за 2 мин. Опыт более 15 лет. Звоните!	nalchik.krovstroyrf.ru/uslugi/demontazh-i-remont-krovli?utm_source=yandex&utm_medium=cpc&utm_campaign=nalchik_tenant1
-	Нальчик - Ремонт	устранение протечек крыши нальчик	Ремонт крыши в Нальчик	Гарантия до 39 лет!	Устраним протечки. Бесплатный замер за 2 мин. Опыт более 15 лет. Звоните!	nalchik.krovstroyrf.ru/uslugi/demontazh-i-remont-krovli?utm_source=yandex&utm_medium=cpc&utm_campaign=nalchik_tenant1
-	Нальчик - Ремонт	ремонт крыши частного дома нальчик	Ремонт крыши в Нальчик	Гарантия до 39 лет!	Устраним протечки. Бесплатный замер за 2 мин. Опыт более 15 лет. Звоните!	nalchik.krovstroyrf.ru/uslugi/demontazh-i-remont-krovli?utm_source=yandex&utm_medium=cpc&utm_campaign=nalchik_tenant1
-	Нальчик - Монтаж	монтаж кровли нальчик	Кровля под ключ в Нальчик	Опытные кровельщики	Надежный монтаж кровли под ключ. Скидка 10% на материалы при заказе! Звони.	nalchik.krovstroyrf.ru/?utm_source=yandex&utm_medium=cpc&utm_campaign=nalchik_tenant1
-	Нальчик - Монтаж	кровельные работы нальчик	Кровля под ключ в Нальчик	Опытные кровельщики	Надежный монтаж кровли под ключ. Скидка 10% на материалы при заказе! Звони.	nalchik.krovstroyrf.ru/?utm_source=yandex&utm_medium=cpc&utm_campaign=nalchik_tenant1
-	Нальчик - Монтаж	крыша под ключ нальчик	Кровля под ключ в Нальчик	Опытные кровельщики	Надежный монтаж кровли под ключ. Скидка 10% на материалы при заказе! Звони.	nalchik.krovstroyrf.ru/?utm_source=yandex&utm_medium=cpc&utm_campaign=nalchik_tenant1
-	Нальчик - Монтаж	перекрыть крышу нальчик	Кровля под ключ в Нальчик	Опытные кровельщики	Надежный монтаж кровли под ключ. Скидка 10% на материалы при заказе! Звони.	nalchik.krovstroyrf.ru/?utm_source=yandex&utm_medium=cpc&utm_campaign=nalchik_tenant1
-	Нальчик - Монтаж	строительство крыши нальчик	Кровля под ключ в Нальчик	Опытные кровельщики	Надежный монтаж кровли под ключ. Скидка 10% на материалы при заказе! Звони.	nalchik.krovstroyrf.ru/?utm_source=yandex&utm_medium=cpc&utm_campaign=nalchik_tenant1
-	Нальчик - Металлочерепица	монтаж металлочерепицы нальчик	Монтаж металлочерепицы	От 1500 руб/м². Под ключ	Качественная кровля из металлочерепицы. Выезд замерщика бесплатно!	nalchik.krovstroyrf.ru/uslugi/montazh-krovli-iz-metallocherepitsy?utm_source=yandex&utm_medium=cpc&utm_campaign=nalchik_tenant1
-	Нальчик - Металлочерепица	крыша из металлочерепицы нальчик	Монтаж металлочерепицы	От 1500 руб/м². Под ключ	Качественная кровля из металлочерепицы. Выезд замерщика бесплатно!	nalchik.krovstroyrf.ru/uslugi/montazh-krovli-iz-metallocherepitsy?utm_source=yandex&utm_medium=cpc&utm_campaign=nalchik_tenant1
-	Нальчик - Металлочерепица	металлочерепица под ключ нальчик	Монтаж металлочерепицы	От 1500 руб/м². Под ключ	Качественная кровля из металлочерепицы. Выезд замерщика бесплатно!	nalchik.krovstroyrf.ru/uslugi/montazh-krovli-iz-metallocherepitsy?utm_source=yandex&utm_medium=cpc&utm_campaign=nalchik_tenant1
-	Нальчик - Металлочерепица	кровля металлочерепица цена нальчик	Монтаж металлочерепицы	От 1500 руб/м². Под ключ	Качественная кровля из металлочерепицы. Выезд замерщика бесплатно!	nalchik.krovstroyrf.ru/uslugi/montazh-krovli-iz-metallocherepitsy?utm_source=yandex&utm_medium=cpc&utm_campaign=nalchik_tenant1
-	Нальчик - Профнастил	монтаж профнастила на крышу нальчик	Кровля из профнастила	От 1400 руб/м² в Нальчик	Надежный монтаж крыши из профнастила. Строго по договору без скрытых платежей.	nalchik.krovstroyrf.ru/uslugi/montazh-krovli-iz-profnastila?utm_source=yandex&utm_medium=cpc&utm_campaign=nalchik_tenant1
-	Нальчик - Профнастил	крыша из профнастила нальчик	Кровля из профнастила	От 1400 руб/м² в Нальчик	Надежный монтаж крыши из профнастила. Строго по договору без скрытых платежей.	nalchik.krovstroyrf.ru/uslugi/montazh-krovli-iz-profnastila?utm_source=yandex&utm_medium=cpc&utm_campaign=nalchik_tenant1
-	Нальчик - Профнастил	перекрыть крышу профлистом нальчик	Кровля из профнастила	От 1400 руб/м² в Нальчик	Надежный монтаж крыши из профнастила. Строго по договору без скрытых платежей.	nalchik.krovstroyrf.ru/uslugi/montazh-krovli-iz-profnastila?utm_source=yandex&utm_medium=cpc&utm_campaign=nalchik_tenant1
-	Нальчик - Профнастил	кровля профнастил цена нальчик	Кровля из профнастила	От 1400 руб/м² в Нальчик	Надежный монтаж крыши из профнастила. Строго по договору без скрытых платежей.	nalchik.krovstroyrf.ru/uslugi/montazh-krovli-iz-profnastila?utm_source=yandex&utm_medium=cpc&utm_campaign=nalchik_tenant1
-	Нальчик - Гибкая черепица	монтаж мягкой кровли нальчик	Монтаж гибкой черепицы	Идеальная крыша для дома	Профессиональная укладка гибкой (мягкой) черепицы от 1800 руб/м². Гарантия!	nalchik.krovstroyrf.ru/uslugi/montazh-krovli-iz-gibkoj-cherepitsy?utm_source=yandex&utm_medium=cpc&utm_campaign=nalchik_tenant1
-	Нальчик - Гибкая черепица	гибкая черепица монтаж нальчик	Монтаж гибкой черепицы	Идеальная крыша для дома	Профессиональная укладка гибкой (мягкой) черепицы от 1800 руб/м². Гарантия!	nalchik.krovstroyrf.ru/uslugi/montazh-krovli-iz-gibkoj-cherepitsy?utm_source=yandex&utm_medium=cpc&utm_campaign=nalchik_tenant1
-	Нальчик - Гибкая черепица	мягкая кровля цена нальчик	Монтаж гибкой черепицы	Идеальная крыша для дома	Профессиональная укладка гибкой (мягкой) черепицы от 1800 руб/м². Гарантия!	nalchik.krovstroyrf.ru/uslugi/montazh-krovli-iz-gibkoj-cherepitsy?utm_source=yandex&utm_medium=cpc&utm_campaign=nalchik_tenant1
-	Нальчик - Гибкая черепица	укладка мягкой черепицы нальчик	Монтаж гибкой черепицы	Идеальная крыша для дома	Профессиональная укладка гибкой (мягкой) черепицы от 1800 руб/м². Гарантия!	nalchik.krovstroyrf.ru/uslugi/montazh-krovli-iz-gibkoj-cherepitsy?utm_source=yandex&utm_medium=cpc&utm_campaign=nalchik_tenant1
