Доп. объявление	Название группы	Фраза (с минус-словами)	Заголовок 1	Заголовок 2	Текст	Ссылка
-	Барнаул - Ремонт	ремонт кровли барнаул	Ремонт крыши в Барнаул	Гарантия до 39 лет!	Устраним протечки. Бесплатный замер за 2 мин. Опыт более 15 лет. Звоните!	barnaul.krovstroyrf.ru/uslugi/demontazh-i-remont-krovli?utm_source=yandex&utm_medium=cpc&utm_campaign=barnaul_tenant1
-	Барнаул - Ремонт	ремонт крыши барнаул	Ремонт крыши в Барнаул	Гарантия до 39 лет!	Устраним протечки. Бесплатный замер за 2 мин. Опыт более 15 лет. Звоните!	barnaul.krovstroyrf.ru/uslugi/demontazh-i-remont-krovli?utm_source=yandex&utm_medium=cpc&utm_campaign=barnaul_tenant1
-	Барнаул - Ремонт	демонтаж крыши барнаул	Ремонт крыши в Барнаул	Гарантия до 39 лет!	Устраним протечки. Бесплатный замер за 2 мин. Опыт более 15 лет. Звоните!	barnaul.krovstroyrf.ru/uslugi/demontazh-i-remont-krovli?utm_source=yandex&utm_medium=cpc&utm_campaign=barnaul_tenant1
-	Барнаул - Ремонт	устранение протечек крыши барнаул	Ремонт крыши в Барнаул	Гарантия до 39 лет!	Устраним протечки. Бесплатный замер за 2 мин. Опыт более 15 лет. Звоните!	barnaul.krovstroyrf.ru/uslugi/demontazh-i-remont-krovli?utm_source=yandex&utm_medium=cpc&utm_campaign=barnaul_tenant1
-	Барнаул - Ремонт	ремонт крыши частного дома барнаул	Ремонт крыши в Барнаул	Гарантия до 39 лет!	Устраним протечки. Бесплатный замер за 2 мин. Опыт более 15 лет. Звоните!	barnaul.krovstroyrf.ru/uslugi/demontazh-i-remont-krovli?utm_source=yandex&utm_medium=cpc&utm_campaign=barnaul_tenant1
-	Барнаул - Монтаж	монтаж кровли барнаул	Кровля под ключ в Барнаул	Опытные кровельщики	Надежный монтаж кровли под ключ. Скидка 10% на материалы при заказе! Звони.	barnaul.krovstroyrf.ru/?utm_source=yandex&utm_medium=cpc&utm_campaign=barnaul_tenant1
-	Барнаул - Монтаж	кровельные работы барнаул	Кровля под ключ в Барнаул	Опытные кровельщики	Надежный монтаж кровли под ключ. Скидка 10% на материалы при заказе! Звони.	barnaul.krovstroyrf.ru/?utm_source=yandex&utm_medium=cpc&utm_campaign=barnaul_tenant1
-	Барнаул - Монтаж	крыша под ключ барнаул	Кровля под ключ в Барнаул	Опытные кровельщики	Надежный монтаж кровли под ключ. Скидка 10% на материалы при заказе! Звони.	barnaul.krovstroyrf.ru/?utm_source=yandex&utm_medium=cpc&utm_campaign=barnaul_tenant1
-	Барнаул - Монтаж	перекрыть крышу барнаул	Кровля под ключ в Барнаул	Опытные кровельщики	Надежный монтаж кровли под ключ. Скидка 10% на материалы при заказе! Звони.	barnaul.krovstroyrf.ru/?utm_source=yandex&utm_medium=cpc&utm_campaign=barnaul_tenant1
-	Барнаул - Монтаж	строительство крыши барнаул	Кровля под ключ в Барнаул	Опытные кровельщики	Надежный монтаж кровли под ключ. Скидка 10% на материалы при заказе! Звони.	barnaul.krovstroyrf.ru/?utm_source=yandex&utm_medium=cpc&utm_campaign=barnaul_tenant1
-	Барнаул - Металлочерепица	монтаж металлочерепицы барнаул	Монтаж металлочерепицы	От 1500 руб/м². Под ключ	Качественная кровля из металлочерепицы. Выезд замерщика бесплатно!	barnaul.krovstroyrf.ru/uslugi/montazh-krovli-iz-metallocherepitsy?utm_source=yandex&utm_medium=cpc&utm_campaign=barnaul_tenant1
-	Барнаул - Металлочерепица	крыша из металлочерепицы барнаул	Монтаж металлочерепицы	От 1500 руб/м². Под ключ	Качественная кровля из металлочерепицы. Выезд замерщика бесплатно!	barnaul.krovstroyrf.ru/uslugi/montazh-krovli-iz-metallocherepitsy?utm_source=yandex&utm_medium=cpc&utm_campaign=barnaul_tenant1
-	Барнаул - Металлочерепица	металлочерепица под ключ барнаул	Монтаж металлочерепицы	От 1500 руб/м². Под ключ	Качественная кровля из металлочерепицы. Выезд замерщика бесплатно!	barnaul.krovstroyrf.ru/uslugi/montazh-krovli-iz-metallocherepitsy?utm_source=yandex&utm_medium=cpc&utm_campaign=barnaul_tenant1
-	Барнаул - Металлочерепица	кровля металлочерепица цена барнаул	Монтаж металлочерепицы	От 1500 руб/м². Под ключ	Качественная кровля из металлочерепицы. Выезд замерщика бесплатно!	barnaul.krovstroyrf.ru/uslugi/montazh-krovli-iz-metallocherepitsy?utm_source=yandex&utm_medium=cpc&utm_campaign=barnaul_tenant1
-	Барнаул - Профнастил	монтаж профнастила на крышу барнаул	Кровля из профнастила	От 1400 руб/м² в Барнаул	Надежный монтаж крыши из профнастила. Строго по договору без скрытых платежей.	barnaul.krovstroyrf.ru/uslugi/montazh-krovli-iz-profnastila?utm_source=yandex&utm_medium=cpc&utm_campaign=barnaul_tenant1
-	Барнаул - Профнастил	крыша из профнастила барнаул	Кровля из профнастила	От 1400 руб/м² в Барнаул	Надежный монтаж крыши из профнастила. Строго по договору без скрытых платежей.	barnaul.krovstroyrf.ru/uslugi/montazh-krovli-iz-profnastila?utm_source=yandex&utm_medium=cpc&utm_campaign=barnaul_tenant1
-	Барнаул - Профнастил	перекрыть крышу профлистом барнаул	Кровля из профнастила	От 1400 руб/м² в Барнаул	Надежный монтаж крыши из профнастила. Строго по договору без скрытых платежей.	barnaul.krovstroyrf.ru/uslugi/montazh-krovli-iz-profnastila?utm_source=yandex&utm_medium=cpc&utm_campaign=barnaul_tenant1
-	Барнаул - Профнастил	кровля профнастил цена барнаул	Кровля из профнастила	От 1400 руб/м² в Барнаул	Надежный монтаж крыши из профнастила. Строго по договору без скрытых платежей.	barnaul.krovstroyrf.ru/uslugi/montazh-krovli-iz-profnastila?utm_source=yandex&utm_medium=cpc&utm_campaign=barnaul_tenant1
-	Барнаул - Гибкая черепица	монтаж мягкой кровли барнаул	Монтаж гибкой черепицы	Идеальная крыша для дома	Профессиональная укладка гибкой (мягкой) черепицы от 1800 руб/м². Гарантия!	barnaul.krovstroyrf.ru/uslugi/montazh-krovli-iz-gibkoj-cherepitsy?utm_source=yandex&utm_medium=cpc&utm_campaign=barnaul_tenant1
-	Барнаул - Гибкая черепица	гибкая черепица монтаж барнаул	Монтаж гибкой черепицы	Идеальная крыша для дома	Профессиональная укладка гибкой (мягкой) черепицы от 1800 руб/м². Гарантия!	barnaul.krovstroyrf.ru/uslugi/montazh-krovli-iz-gibkoj-cherepitsy?utm_source=yandex&utm_medium=cpc&utm_campaign=barnaul_tenant1
-	Барнаул - Гибкая черепица	мягкая кровля цена барнаул	Монтаж гибкой черепицы	Идеальная крыша для дома	Профессиональная укладка гибкой (мягкой) черепицы от 1800 руб/м². Гарантия!	barnaul.krovstroyrf.ru/uslugi/montazh-krovli-iz-gibkoj-cherepitsy?utm_source=yandex&utm_medium=cpc&utm_campaign=barnaul_tenant1
-	Барнаул - Гибкая черепица	укладка мягкой черепицы барнаул	Монтаж гибкой черепицы	Идеальная крыша для дома	Профессиональная укладка гибкой (мягкой) черепицы от 1800 руб/м². Гарантия!	barnaul.krovstroyrf.ru/uslugi/montazh-krovli-iz-gibkoj-cherepitsy?utm_source=yandex&utm_medium=cpc&utm_campaign=barnaul_tenant1
