Доп. объявление	Название группы	Фраза (с минус-словами)	Заголовок 1	Заголовок 2	Текст	Ссылка
-	Череповец - Ремонт	ремонт кровли череповец	Ремонт крыши в Череповец	Гарантия до 39 лет!	Устраним протечки. Бесплатный замер за 2 мин. Опыт более 15 лет. Звоните!	cherepovets.krovstroyrf.ru/uslugi/demontazh-i-remont-krovli?utm_source=yandex&utm_medium=cpc&utm_campaign=cherepovets_tenant1
-	Череповец - Ремонт	ремонт крыши череповец	Ремонт крыши в Череповец	Гарантия до 39 лет!	Устраним протечки. Бесплатный замер за 2 мин. Опыт более 15 лет. Звоните!	cherepovets.krovstroyrf.ru/uslugi/demontazh-i-remont-krovli?utm_source=yandex&utm_medium=cpc&utm_campaign=cherepovets_tenant1
-	Череповец - Ремонт	демонтаж крыши череповец	Ремонт крыши в Череповец	Гарантия до 39 лет!	Устраним протечки. Бесплатный замер за 2 мин. Опыт более 15 лет. Звоните!	cherepovets.krovstroyrf.ru/uslugi/demontazh-i-remont-krovli?utm_source=yandex&utm_medium=cpc&utm_campaign=cherepovets_tenant1
-	Череповец - Ремонт	устранение протечек крыши череповец	Ремонт крыши в Череповец	Гарантия до 39 лет!	Устраним протечки. Бесплатный замер за 2 мин. Опыт более 15 лет. Звоните!	cherepovets.krovstroyrf.ru/uslugi/demontazh-i-remont-krovli?utm_source=yandex&utm_medium=cpc&utm_campaign=cherepovets_tenant1
-	Череповец - Ремонт	ремонт крыши частного дома череповец	Ремонт крыши в Череповец	Гарантия до 39 лет!	Устраним протечки. Бесплатный замер за 2 мин. Опыт более 15 лет. Звоните!	cherepovets.krovstroyrf.ru/uslugi/demontazh-i-remont-krovli?utm_source=yandex&utm_medium=cpc&utm_campaign=cherepovets_tenant1
-	Череповец - Монтаж	монтаж кровли череповец	Кровля под ключ в Череповец	Опытные кровельщики	Надежный монтаж кровли под ключ. Скидка 10% на материалы при заказе! Звони.	cherepovets.krovstroyrf.ru/?utm_source=yandex&utm_medium=cpc&utm_campaign=cherepovets_tenant1
-	Череповец - Монтаж	кровельные работы череповец	Кровля под ключ в Череповец	Опытные кровельщики	Надежный монтаж кровли под ключ. Скидка 10% на материалы при заказе! Звони.	cherepovets.krovstroyrf.ru/?utm_source=yandex&utm_medium=cpc&utm_campaign=cherepovets_tenant1
-	Череповец - Монтаж	крыша под ключ череповец	Кровля под ключ в Череповец	Опытные кровельщики	Надежный монтаж кровли под ключ. Скидка 10% на материалы при заказе! Звони.	cherepovets.krovstroyrf.ru/?utm_source=yandex&utm_medium=cpc&utm_campaign=cherepovets_tenant1
-	Череповец - Монтаж	перекрыть крышу череповец	Кровля под ключ в Череповец	Опытные кровельщики	Надежный монтаж кровли под ключ. Скидка 10% на материалы при заказе! Звони.	cherepovets.krovstroyrf.ru/?utm_source=yandex&utm_medium=cpc&utm_campaign=cherepovets_tenant1
-	Череповец - Монтаж	строительство крыши череповец	Кровля под ключ в Череповец	Опытные кровельщики	Надежный монтаж кровли под ключ. Скидка 10% на материалы при заказе! Звони.	cherepovets.krovstroyrf.ru/?utm_source=yandex&utm_medium=cpc&utm_campaign=cherepovets_tenant1
-	Череповец - Металлочерепица	монтаж металлочерепицы череповец	Монтаж металлочерепицы	От 1500 руб/м². Под ключ	Качественная кровля из металлочерепицы. Выезд замерщика бесплатно!	cherepovets.krovstroyrf.ru/uslugi/montazh-krovli-iz-metallocherepitsy?utm_source=yandex&utm_medium=cpc&utm_campaign=cherepovets_tenant1
-	Череповец - Металлочерепица	крыша из металлочерепицы череповец	Монтаж металлочерепицы	От 1500 руб/м². Под ключ	Качественная кровля из металлочерепицы. Выезд замерщика бесплатно!	cherepovets.krovstroyrf.ru/uslugi/montazh-krovli-iz-metallocherepitsy?utm_source=yandex&utm_medium=cpc&utm_campaign=cherepovets_tenant1
-	Череповец - Металлочерепица	металлочерепица под ключ череповец	Монтаж металлочерепицы	От 1500 руб/м². Под ключ	Качественная кровля из металлочерепицы. Выезд замерщика бесплатно!	cherepovets.krovstroyrf.ru/uslugi/montazh-krovli-iz-metallocherepitsy?utm_source=yandex&utm_medium=cpc&utm_campaign=cherepovets_tenant1
-	Череповец - Металлочерепица	кровля металлочерепица цена череповец	Монтаж металлочерепицы	От 1500 руб/м². Под ключ	Качественная кровля из металлочерепицы. Выезд замерщика бесплатно!	cherepovets.krovstroyrf.ru/uslugi/montazh-krovli-iz-metallocherepitsy?utm_source=yandex&utm_medium=cpc&utm_campaign=cherepovets_tenant1
-	Череповец - Профнастил	монтаж профнастила на крышу череповец	Кровля из профнастила	От 1400 руб/м² в Череповец	Надежный монтаж крыши из профнастила. Строго по договору без скрытых платежей.	cherepovets.krovstroyrf.ru/uslugi/montazh-krovli-iz-profnastila?utm_source=yandex&utm_medium=cpc&utm_campaign=cherepovets_tenant1
-	Череповец - Профнастил	крыша из профнастила череповец	Кровля из профнастила	От 1400 руб/м² в Череповец	Надежный монтаж крыши из профнастила. Строго по договору без скрытых платежей.	cherepovets.krovstroyrf.ru/uslugi/montazh-krovli-iz-profnastila?utm_source=yandex&utm_medium=cpc&utm_campaign=cherepovets_tenant1
-	Череповец - Профнастил	перекрыть крышу профлистом череповец	Кровля из профнастила	От 1400 руб/м² в Череповец	Надежный монтаж крыши из профнастила. Строго по договору без скрытых платежей.	cherepovets.krovstroyrf.ru/uslugi/montazh-krovli-iz-profnastila?utm_source=yandex&utm_medium=cpc&utm_campaign=cherepovets_tenant1
-	Череповец - Профнастил	кровля профнастил цена череповец	Кровля из профнастила	От 1400 руб/м² в Череповец	Надежный монтаж крыши из профнастила. Строго по договору без скрытых платежей.	cherepovets.krovstroyrf.ru/uslugi/montazh-krovli-iz-profnastila?utm_source=yandex&utm_medium=cpc&utm_campaign=cherepovets_tenant1
-	Череповец - Гибкая черепица	монтаж мягкой кровли череповец	Монтаж гибкой черепицы	Идеальная крыша для дома	Профессиональная укладка гибкой (мягкой) черепицы от 1800 руб/м². Гарантия!	cherepovets.krovstroyrf.ru/uslugi/montazh-krovli-iz-gibkoj-cherepitsy?utm_source=yandex&utm_medium=cpc&utm_campaign=cherepovets_tenant1
-	Череповец - Гибкая черепица	гибкая черепица монтаж череповец	Монтаж гибкой черепицы	Идеальная крыша для дома	Профессиональная укладка гибкой (мягкой) черепицы от 1800 руб/м². Гарантия!	cherepovets.krovstroyrf.ru/uslugi/montazh-krovli-iz-gibkoj-cherepitsy?utm_source=yandex&utm_medium=cpc&utm_campaign=cherepovets_tenant1
-	Череповец - Гибкая черепица	мягкая кровля цена череповец	Монтаж гибкой черепицы	Идеальная крыша для дома	Профессиональная укладка гибкой (мягкой) черепицы от 1800 руб/м². Гарантия!	cherepovets.krovstroyrf.ru/uslugi/montazh-krovli-iz-gibkoj-cherepitsy?utm_source=yandex&utm_medium=cpc&utm_campaign=cherepovets_tenant1
-	Череповец - Гибкая черепица	укладка мягкой черепицы череповец	Монтаж гибкой черепицы	Идеальная крыша для дома	Профессиональная укладка гибкой (мягкой) черепицы от 1800 руб/м². Гарантия!	cherepovets.krovstroyrf.ru/uslugi/montazh-krovli-iz-gibkoj-cherepitsy?utm_source=yandex&utm_medium=cpc&utm_campaign=cherepovets_tenant1
