Доп. объявление	Название группы	Фраза (с минус-словами)	Заголовок 1	Заголовок 2	Текст	Ссылка
-	Вологда - Ремонт	ремонт кровли вологда	Ремонт крыши в Вологда	Гарантия до 39 лет!	Устраним протечки. Бесплатный замер за 2 мин. Опыт более 15 лет. Звоните!	vologda.krovstroyrf.ru/uslugi/demontazh-i-remont-krovli?utm_source=yandex&utm_medium=cpc&utm_campaign=vologda_tenant1
-	Вологда - Ремонт	ремонт крыши вологда	Ремонт крыши в Вологда	Гарантия до 39 лет!	Устраним протечки. Бесплатный замер за 2 мин. Опыт более 15 лет. Звоните!	vologda.krovstroyrf.ru/uslugi/demontazh-i-remont-krovli?utm_source=yandex&utm_medium=cpc&utm_campaign=vologda_tenant1
-	Вологда - Ремонт	демонтаж крыши вологда	Ремонт крыши в Вологда	Гарантия до 39 лет!	Устраним протечки. Бесплатный замер за 2 мин. Опыт более 15 лет. Звоните!	vologda.krovstroyrf.ru/uslugi/demontazh-i-remont-krovli?utm_source=yandex&utm_medium=cpc&utm_campaign=vologda_tenant1
-	Вологда - Ремонт	устранение протечек крыши вологда	Ремонт крыши в Вологда	Гарантия до 39 лет!	Устраним протечки. Бесплатный замер за 2 мин. Опыт более 15 лет. Звоните!	vologda.krovstroyrf.ru/uslugi/demontazh-i-remont-krovli?utm_source=yandex&utm_medium=cpc&utm_campaign=vologda_tenant1
-	Вологда - Ремонт	ремонт крыши частного дома вологда	Ремонт крыши в Вологда	Гарантия до 39 лет!	Устраним протечки. Бесплатный замер за 2 мин. Опыт более 15 лет. Звоните!	vologda.krovstroyrf.ru/uslugi/demontazh-i-remont-krovli?utm_source=yandex&utm_medium=cpc&utm_campaign=vologda_tenant1
-	Вологда - Монтаж	монтаж кровли вологда	Кровля под ключ в Вологда	Опытные кровельщики	Надежный монтаж кровли под ключ. Скидка 10% на материалы при заказе! Звони.	vologda.krovstroyrf.ru/?utm_source=yandex&utm_medium=cpc&utm_campaign=vologda_tenant1
-	Вологда - Монтаж	кровельные работы вологда	Кровля под ключ в Вологда	Опытные кровельщики	Надежный монтаж кровли под ключ. Скидка 10% на материалы при заказе! Звони.	vologda.krovstroyrf.ru/?utm_source=yandex&utm_medium=cpc&utm_campaign=vologda_tenant1
-	Вологда - Монтаж	крыша под ключ вологда	Кровля под ключ в Вологда	Опытные кровельщики	Надежный монтаж кровли под ключ. Скидка 10% на материалы при заказе! Звони.	vologda.krovstroyrf.ru/?utm_source=yandex&utm_medium=cpc&utm_campaign=vologda_tenant1
-	Вологда - Монтаж	перекрыть крышу вологда	Кровля под ключ в Вологда	Опытные кровельщики	Надежный монтаж кровли под ключ. Скидка 10% на материалы при заказе! Звони.	vologda.krovstroyrf.ru/?utm_source=yandex&utm_medium=cpc&utm_campaign=vologda_tenant1
-	Вологда - Монтаж	строительство крыши вологда	Кровля под ключ в Вологда	Опытные кровельщики	Надежный монтаж кровли под ключ. Скидка 10% на материалы при заказе! Звони.	vologda.krovstroyrf.ru/?utm_source=yandex&utm_medium=cpc&utm_campaign=vologda_tenant1
-	Вологда - Металлочерепица	монтаж металлочерепицы вологда	Монтаж металлочерепицы	От 1500 руб/м². Под ключ	Качественная кровля из металлочерепицы. Выезд замерщика бесплатно!	vologda.krovstroyrf.ru/uslugi/montazh-krovli-iz-metallocherepitsy?utm_source=yandex&utm_medium=cpc&utm_campaign=vologda_tenant1
-	Вологда - Металлочерепица	крыша из металлочерепицы вологда	Монтаж металлочерепицы	От 1500 руб/м². Под ключ	Качественная кровля из металлочерепицы. Выезд замерщика бесплатно!	vologda.krovstroyrf.ru/uslugi/montazh-krovli-iz-metallocherepitsy?utm_source=yandex&utm_medium=cpc&utm_campaign=vologda_tenant1
-	Вологда - Металлочерепица	металлочерепица под ключ вологда	Монтаж металлочерепицы	От 1500 руб/м². Под ключ	Качественная кровля из металлочерепицы. Выезд замерщика бесплатно!	vologda.krovstroyrf.ru/uslugi/montazh-krovli-iz-metallocherepitsy?utm_source=yandex&utm_medium=cpc&utm_campaign=vologda_tenant1
-	Вологда - Металлочерепица	кровля металлочерепица цена вологда	Монтаж металлочерепицы	От 1500 руб/м². Под ключ	Качественная кровля из металлочерепицы. Выезд замерщика бесплатно!	vologda.krovstroyrf.ru/uslugi/montazh-krovli-iz-metallocherepitsy?utm_source=yandex&utm_medium=cpc&utm_campaign=vologda_tenant1
-	Вологда - Профнастил	монтаж профнастила на крышу вологда	Кровля из профнастила	От 1400 руб/м² в Вологда	Надежный монтаж крыши из профнастила. Строго по договору без скрытых платежей.	vologda.krovstroyrf.ru/uslugi/montazh-krovli-iz-profnastila?utm_source=yandex&utm_medium=cpc&utm_campaign=vologda_tenant1
-	Вологда - Профнастил	крыша из профнастила вологда	Кровля из профнастила	От 1400 руб/м² в Вологда	Надежный монтаж крыши из профнастила. Строго по договору без скрытых платежей.	vologda.krovstroyrf.ru/uslugi/montazh-krovli-iz-profnastila?utm_source=yandex&utm_medium=cpc&utm_campaign=vologda_tenant1
-	Вологда - Профнастил	перекрыть крышу профлистом вологда	Кровля из профнастила	От 1400 руб/м² в Вологда	Надежный монтаж крыши из профнастила. Строго по договору без скрытых платежей.	vologda.krovstroyrf.ru/uslugi/montazh-krovli-iz-profnastila?utm_source=yandex&utm_medium=cpc&utm_campaign=vologda_tenant1
-	Вологда - Профнастил	кровля профнастил цена вологда	Кровля из профнастила	От 1400 руб/м² в Вологда	Надежный монтаж крыши из профнастила. Строго по договору без скрытых платежей.	vologda.krovstroyrf.ru/uslugi/montazh-krovli-iz-profnastila?utm_source=yandex&utm_medium=cpc&utm_campaign=vologda_tenant1
-	Вологда - Гибкая черепица	монтаж мягкой кровли вологда	Монтаж гибкой черепицы	Идеальная крыша для дома	Профессиональная укладка гибкой (мягкой) черепицы от 1800 руб/м². Гарантия!	vologda.krovstroyrf.ru/uslugi/montazh-krovli-iz-gibkoj-cherepitsy?utm_source=yandex&utm_medium=cpc&utm_campaign=vologda_tenant1
-	Вологда - Гибкая черепица	гибкая черепица монтаж вологда	Монтаж гибкой черепицы	Идеальная крыша для дома	Профессиональная укладка гибкой (мягкой) черепицы от 1800 руб/м². Гарантия!	vologda.krovstroyrf.ru/uslugi/montazh-krovli-iz-gibkoj-cherepitsy?utm_source=yandex&utm_medium=cpc&utm_campaign=vologda_tenant1
-	Вологда - Гибкая черепица	мягкая кровля цена вологда	Монтаж гибкой черепицы	Идеальная крыша для дома	Профессиональная укладка гибкой (мягкой) черепицы от 1800 руб/м². Гарантия!	vologda.krovstroyrf.ru/uslugi/montazh-krovli-iz-gibkoj-cherepitsy?utm_source=yandex&utm_medium=cpc&utm_campaign=vologda_tenant1
-	Вологда - Гибкая черепица	укладка мягкой черепицы вологда	Монтаж гибкой черепицы	Идеальная крыша для дома	Профессиональная укладка гибкой (мягкой) черепицы от 1800 руб/м². Гарантия!	vologda.krovstroyrf.ru/uslugi/montazh-krovli-iz-gibkoj-cherepitsy?utm_source=yandex&utm_medium=cpc&utm_campaign=vologda_tenant1
