Доп. объявление	Название группы	Фраза (с минус-словами)	Заголовок 1	Заголовок 2	Текст	Ссылка
-	Набережные Челны - Ремонт	ремонт кровли набережные челны	Ремонт крыши в Набережные Челны	Гарантия до 39 лет!	Устраним протечки. Бесплатный замер за 2 мин. Опыт более 15 лет. Звоните!	naberezhnye-chelny.krovstroyrf.ru/uslugi/demontazh-i-remont-krovli?utm_source=yandex&utm_medium=cpc&utm_campaign=naberezhnye-chelny_tenant1
-	Набережные Челны - Ремонт	ремонт крыши набережные челны	Ремонт крыши в Набережные Челны	Гарантия до 39 лет!	Устраним протечки. Бесплатный замер за 2 мин. Опыт более 15 лет. Звоните!	naberezhnye-chelny.krovstroyrf.ru/uslugi/demontazh-i-remont-krovli?utm_source=yandex&utm_medium=cpc&utm_campaign=naberezhnye-chelny_tenant1
-	Набережные Челны - Ремонт	демонтаж крыши набережные челны	Ремонт крыши в Набережные Челны	Гарантия до 39 лет!	Устраним протечки. Бесплатный замер за 2 мин. Опыт более 15 лет. Звоните!	naberezhnye-chelny.krovstroyrf.ru/uslugi/demontazh-i-remont-krovli?utm_source=yandex&utm_medium=cpc&utm_campaign=naberezhnye-chelny_tenant1
-	Набережные Челны - Ремонт	устранение протечек крыши набережные челны	Ремонт крыши в Набережные Челны	Гарантия до 39 лет!	Устраним протечки. Бесплатный замер за 2 мин. Опыт более 15 лет. Звоните!	naberezhnye-chelny.krovstroyrf.ru/uslugi/demontazh-i-remont-krovli?utm_source=yandex&utm_medium=cpc&utm_campaign=naberezhnye-chelny_tenant1
-	Набережные Челны - Ремонт	ремонт крыши частного дома набережные челны	Ремонт крыши в Набережные Челны	Гарантия до 39 лет!	Устраним протечки. Бесплатный замер за 2 мин. Опыт более 15 лет. Звоните!	naberezhnye-chelny.krovstroyrf.ru/uslugi/demontazh-i-remont-krovli?utm_source=yandex&utm_medium=cpc&utm_campaign=naberezhnye-chelny_tenant1
-	Набережные Челны - Монтаж	монтаж кровли набережные челны	Кровля под ключ в Набережные Челны	Опытные кровельщики	Надежный монтаж кровли под ключ. Скидка 10% на материалы при заказе! Звони.	naberezhnye-chelny.krovstroyrf.ru/?utm_source=yandex&utm_medium=cpc&utm_campaign=naberezhnye-chelny_tenant1
-	Набережные Челны - Монтаж	кровельные работы набережные челны	Кровля под ключ в Набережные Челны	Опытные кровельщики	Надежный монтаж кровли под ключ. Скидка 10% на материалы при заказе! Звони.	naberezhnye-chelny.krovstroyrf.ru/?utm_source=yandex&utm_medium=cpc&utm_campaign=naberezhnye-chelny_tenant1
-	Набережные Челны - Монтаж	крыша под ключ набережные челны	Кровля под ключ в Набережные Челны	Опытные кровельщики	Надежный монтаж кровли под ключ. Скидка 10% на материалы при заказе! Звони.	naberezhnye-chelny.krovstroyrf.ru/?utm_source=yandex&utm_medium=cpc&utm_campaign=naberezhnye-chelny_tenant1
-	Набережные Челны - Монтаж	перекрыть крышу набережные челны	Кровля под ключ в Набережные Челны	Опытные кровельщики	Надежный монтаж кровли под ключ. Скидка 10% на материалы при заказе! Звони.	naberezhnye-chelny.krovstroyrf.ru/?utm_source=yandex&utm_medium=cpc&utm_campaign=naberezhnye-chelny_tenant1
-	Набережные Челны - Монтаж	строительство крыши набережные челны	Кровля под ключ в Набережные Челны	Опытные кровельщики	Надежный монтаж кровли под ключ. Скидка 10% на материалы при заказе! Звони.	naberezhnye-chelny.krovstroyrf.ru/?utm_source=yandex&utm_medium=cpc&utm_campaign=naberezhnye-chelny_tenant1
-	Набережные Челны - Металлочерепица	монтаж металлочерепицы набережные челны	Монтаж металлочерепицы	От 1500 руб/м². Под ключ	Качественная кровля из металлочерепицы. Выезд замерщика бесплатно!	naberezhnye-chelny.krovstroyrf.ru/uslugi/montazh-krovli-iz-metallocherepitsy?utm_source=yandex&utm_medium=cpc&utm_campaign=naberezhnye-chelny_tenant1
-	Набережные Челны - Металлочерепица	крыша из металлочерепицы набережные челны	Монтаж металлочерепицы	От 1500 руб/м². Под ключ	Качественная кровля из металлочерепицы. Выезд замерщика бесплатно!	naberezhnye-chelny.krovstroyrf.ru/uslugi/montazh-krovli-iz-metallocherepitsy?utm_source=yandex&utm_medium=cpc&utm_campaign=naberezhnye-chelny_tenant1
-	Набережные Челны - Металлочерепица	металлочерепица под ключ набережные челны	Монтаж металлочерепицы	От 1500 руб/м². Под ключ	Качественная кровля из металлочерепицы. Выезд замерщика бесплатно!	naberezhnye-chelny.krovstroyrf.ru/uslugi/montazh-krovli-iz-metallocherepitsy?utm_source=yandex&utm_medium=cpc&utm_campaign=naberezhnye-chelny_tenant1
-	Набережные Челны - Металлочерепица	кровля металлочерепица цена набережные челны	Монтаж металлочерепицы	От 1500 руб/м². Под ключ	Качественная кровля из металлочерепицы. Выезд замерщика бесплатно!	naberezhnye-chelny.krovstroyrf.ru/uslugi/montazh-krovli-iz-metallocherepitsy?utm_source=yandex&utm_medium=cpc&utm_campaign=naberezhnye-chelny_tenant1
-	Набережные Челны - Профнастил	монтаж профнастила на крышу набережные челны	Кровля из профнастила	От 1400 руб/м² в Набережные Челны	Надежный монтаж крыши из профнастила. Строго по договору без скрытых платежей.	naberezhnye-chelny.krovstroyrf.ru/uslugi/montazh-krovli-iz-profnastila?utm_source=yandex&utm_medium=cpc&utm_campaign=naberezhnye-chelny_tenant1
-	Набережные Челны - Профнастил	крыша из профнастила набережные челны	Кровля из профнастила	От 1400 руб/м² в Набережные Челны	Надежный монтаж крыши из профнастила. Строго по договору без скрытых платежей.	naberezhnye-chelny.krovstroyrf.ru/uslugi/montazh-krovli-iz-profnastila?utm_source=yandex&utm_medium=cpc&utm_campaign=naberezhnye-chelny_tenant1
-	Набережные Челны - Профнастил	перекрыть крышу профлистом набережные челны	Кровля из профнастила	От 1400 руб/м² в Набережные Челны	Надежный монтаж крыши из профнастила. Строго по договору без скрытых платежей.	naberezhnye-chelny.krovstroyrf.ru/uslugi/montazh-krovli-iz-profnastila?utm_source=yandex&utm_medium=cpc&utm_campaign=naberezhnye-chelny_tenant1
-	Набережные Челны - Профнастил	кровля профнастил цена набережные челны	Кровля из профнастила	От 1400 руб/м² в Набережные Челны	Надежный монтаж крыши из профнастила. Строго по договору без скрытых платежей.	naberezhnye-chelny.krovstroyrf.ru/uslugi/montazh-krovli-iz-profnastila?utm_source=yandex&utm_medium=cpc&utm_campaign=naberezhnye-chelny_tenant1
-	Набережные Челны - Гибкая черепица	монтаж мягкой кровли набережные челны	Монтаж гибкой черепицы	Идеальная крыша для дома	Профессиональная укладка гибкой (мягкой) черепицы от 1800 руб/м². Гарантия!	naberezhnye-chelny.krovstroyrf.ru/uslugi/montazh-krovli-iz-gibkoj-cherepitsy?utm_source=yandex&utm_medium=cpc&utm_campaign=naberezhnye-chelny_tenant1
-	Набережные Челны - Гибкая черепица	гибкая черепица монтаж набережные челны	Монтаж гибкой черепицы	Идеальная крыша для дома	Профессиональная укладка гибкой (мягкой) черепицы от 1800 руб/м². Гарантия!	naberezhnye-chelny.krovstroyrf.ru/uslugi/montazh-krovli-iz-gibkoj-cherepitsy?utm_source=yandex&utm_medium=cpc&utm_campaign=naberezhnye-chelny_tenant1
-	Набережные Челны - Гибкая черепица	мягкая кровля цена набережные челны	Монтаж гибкой черепицы	Идеальная крыша для дома	Профессиональная укладка гибкой (мягкой) черепицы от 1800 руб/м². Гарантия!	naberezhnye-chelny.krovstroyrf.ru/uslugi/montazh-krovli-iz-gibkoj-cherepitsy?utm_source=yandex&utm_medium=cpc&utm_campaign=naberezhnye-chelny_tenant1
-	Набережные Челны - Гибкая черепица	укладка мягкой черепицы набережные челны	Монтаж гибкой черепицы	Идеальная крыша для дома	Профессиональная укладка гибкой (мягкой) черепицы от 1800 руб/м². Гарантия!	naberezhnye-chelny.krovstroyrf.ru/uslugi/montazh-krovli-iz-gibkoj-cherepitsy?utm_source=yandex&utm_medium=cpc&utm_campaign=naberezhnye-chelny_tenant1
