Доп. объявление	Название группы	Фраза (с минус-словами)	Заголовок 1	Заголовок 2	Текст	Ссылка
-	Тобольск - Ремонт	ремонт кровли тобольск	Ремонт крыши в Тобольск	Гарантия до 39 лет!	Устраним протечки. Бесплатный замер за 2 мин. Опыт более 15 лет. Звоните!	tobolsk.krovstroyrf.ru/uslugi/demontazh-i-remont-krovli?utm_source=yandex&utm_medium=cpc&utm_campaign=tobolsk_tenant1
-	Тобольск - Ремонт	ремонт крыши тобольск	Ремонт крыши в Тобольск	Гарантия до 39 лет!	Устраним протечки. Бесплатный замер за 2 мин. Опыт более 15 лет. Звоните!	tobolsk.krovstroyrf.ru/uslugi/demontazh-i-remont-krovli?utm_source=yandex&utm_medium=cpc&utm_campaign=tobolsk_tenant1
-	Тобольск - Ремонт	демонтаж крыши тобольск	Ремонт крыши в Тобольск	Гарантия до 39 лет!	Устраним протечки. Бесплатный замер за 2 мин. Опыт более 15 лет. Звоните!	tobolsk.krovstroyrf.ru/uslugi/demontazh-i-remont-krovli?utm_source=yandex&utm_medium=cpc&utm_campaign=tobolsk_tenant1
-	Тобольск - Ремонт	устранение протечек крыши тобольск	Ремонт крыши в Тобольск	Гарантия до 39 лет!	Устраним протечки. Бесплатный замер за 2 мин. Опыт более 15 лет. Звоните!	tobolsk.krovstroyrf.ru/uslugi/demontazh-i-remont-krovli?utm_source=yandex&utm_medium=cpc&utm_campaign=tobolsk_tenant1
-	Тобольск - Ремонт	ремонт крыши частного дома тобольск	Ремонт крыши в Тобольск	Гарантия до 39 лет!	Устраним протечки. Бесплатный замер за 2 мин. Опыт более 15 лет. Звоните!	tobolsk.krovstroyrf.ru/uslugi/demontazh-i-remont-krovli?utm_source=yandex&utm_medium=cpc&utm_campaign=tobolsk_tenant1
-	Тобольск - Монтаж	монтаж кровли тобольск	Кровля под ключ в Тобольск	Опытные кровельщики	Надежный монтаж кровли под ключ. Скидка 10% на материалы при заказе! Звони.	tobolsk.krovstroyrf.ru/?utm_source=yandex&utm_medium=cpc&utm_campaign=tobolsk_tenant1
-	Тобольск - Монтаж	кровельные работы тобольск	Кровля под ключ в Тобольск	Опытные кровельщики	Надежный монтаж кровли под ключ. Скидка 10% на материалы при заказе! Звони.	tobolsk.krovstroyrf.ru/?utm_source=yandex&utm_medium=cpc&utm_campaign=tobolsk_tenant1
-	Тобольск - Монтаж	крыша под ключ тобольск	Кровля под ключ в Тобольск	Опытные кровельщики	Надежный монтаж кровли под ключ. Скидка 10% на материалы при заказе! Звони.	tobolsk.krovstroyrf.ru/?utm_source=yandex&utm_medium=cpc&utm_campaign=tobolsk_tenant1
-	Тобольск - Монтаж	перекрыть крышу тобольск	Кровля под ключ в Тобольск	Опытные кровельщики	Надежный монтаж кровли под ключ. Скидка 10% на материалы при заказе! Звони.	tobolsk.krovstroyrf.ru/?utm_source=yandex&utm_medium=cpc&utm_campaign=tobolsk_tenant1
-	Тобольск - Монтаж	строительство крыши тобольск	Кровля под ключ в Тобольск	Опытные кровельщики	Надежный монтаж кровли под ключ. Скидка 10% на материалы при заказе! Звони.	tobolsk.krovstroyrf.ru/?utm_source=yandex&utm_medium=cpc&utm_campaign=tobolsk_tenant1
-	Тобольск - Металлочерепица	монтаж металлочерепицы тобольск	Монтаж металлочерепицы	От 1500 руб/м². Под ключ	Качественная кровля из металлочерепицы. Выезд замерщика бесплатно!	tobolsk.krovstroyrf.ru/uslugi/montazh-krovli-iz-metallocherepitsy?utm_source=yandex&utm_medium=cpc&utm_campaign=tobolsk_tenant1
-	Тобольск - Металлочерепица	крыша из металлочерепицы тобольск	Монтаж металлочерепицы	От 1500 руб/м². Под ключ	Качественная кровля из металлочерепицы. Выезд замерщика бесплатно!	tobolsk.krovstroyrf.ru/uslugi/montazh-krovli-iz-metallocherepitsy?utm_source=yandex&utm_medium=cpc&utm_campaign=tobolsk_tenant1
-	Тобольск - Металлочерепица	металлочерепица под ключ тобольск	Монтаж металлочерепицы	От 1500 руб/м². Под ключ	Качественная кровля из металлочерепицы. Выезд замерщика бесплатно!	tobolsk.krovstroyrf.ru/uslugi/montazh-krovli-iz-metallocherepitsy?utm_source=yandex&utm_medium=cpc&utm_campaign=tobolsk_tenant1
-	Тобольск - Металлочерепица	кровля металлочерепица цена тобольск	Монтаж металлочерепицы	От 1500 руб/м². Под ключ	Качественная кровля из металлочерепицы. Выезд замерщика бесплатно!	tobolsk.krovstroyrf.ru/uslugi/montazh-krovli-iz-metallocherepitsy?utm_source=yandex&utm_medium=cpc&utm_campaign=tobolsk_tenant1
-	Тобольск - Профнастил	монтаж профнастила на крышу тобольск	Кровля из профнастила	От 1400 руб/м² в Тобольск	Надежный монтаж крыши из профнастила. Строго по договору без скрытых платежей.	tobolsk.krovstroyrf.ru/uslugi/montazh-krovli-iz-profnastila?utm_source=yandex&utm_medium=cpc&utm_campaign=tobolsk_tenant1
-	Тобольск - Профнастил	крыша из профнастила тобольск	Кровля из профнастила	От 1400 руб/м² в Тобольск	Надежный монтаж крыши из профнастила. Строго по договору без скрытых платежей.	tobolsk.krovstroyrf.ru/uslugi/montazh-krovli-iz-profnastila?utm_source=yandex&utm_medium=cpc&utm_campaign=tobolsk_tenant1
-	Тобольск - Профнастил	перекрыть крышу профлистом тобольск	Кровля из профнастила	От 1400 руб/м² в Тобольск	Надежный монтаж крыши из профнастила. Строго по договору без скрытых платежей.	tobolsk.krovstroyrf.ru/uslugi/montazh-krovli-iz-profnastila?utm_source=yandex&utm_medium=cpc&utm_campaign=tobolsk_tenant1
-	Тобольск - Профнастил	кровля профнастил цена тобольск	Кровля из профнастила	От 1400 руб/м² в Тобольск	Надежный монтаж крыши из профнастила. Строго по договору без скрытых платежей.	tobolsk.krovstroyrf.ru/uslugi/montazh-krovli-iz-profnastila?utm_source=yandex&utm_medium=cpc&utm_campaign=tobolsk_tenant1
-	Тобольск - Гибкая черепица	монтаж мягкой кровли тобольск	Монтаж гибкой черепицы	Идеальная крыша для дома	Профессиональная укладка гибкой (мягкой) черепицы от 1800 руб/м². Гарантия!	tobolsk.krovstroyrf.ru/uslugi/montazh-krovli-iz-gibkoj-cherepitsy?utm_source=yandex&utm_medium=cpc&utm_campaign=tobolsk_tenant1
-	Тобольск - Гибкая черепица	гибкая черепица монтаж тобольск	Монтаж гибкой черепицы	Идеальная крыша для дома	Профессиональная укладка гибкой (мягкой) черепицы от 1800 руб/м². Гарантия!	tobolsk.krovstroyrf.ru/uslugi/montazh-krovli-iz-gibkoj-cherepitsy?utm_source=yandex&utm_medium=cpc&utm_campaign=tobolsk_tenant1
-	Тобольск - Гибкая черепица	мягкая кровля цена тобольск	Монтаж гибкой черепицы	Идеальная крыша для дома	Профессиональная укладка гибкой (мягкой) черепицы от 1800 руб/м². Гарантия!	tobolsk.krovstroyrf.ru/uslugi/montazh-krovli-iz-gibkoj-cherepitsy?utm_source=yandex&utm_medium=cpc&utm_campaign=tobolsk_tenant1
-	Тобольск - Гибкая черепица	укладка мягкой черепицы тобольск	Монтаж гибкой черепицы	Идеальная крыша для дома	Профессиональная укладка гибкой (мягкой) черепицы от 1800 руб/м². Гарантия!	tobolsk.krovstroyrf.ru/uslugi/montazh-krovli-iz-gibkoj-cherepitsy?utm_source=yandex&utm_medium=cpc&utm_campaign=tobolsk_tenant1
